Sheet: Table1
A1: idTemp | B1: horario | C1: maceracao | D1: cozimento_1 | E1: cozimento_2 | F1: cozimento_3 | G1: moagem | H1: brassagem_1 | I1: brassagem_2 | J1: brassagem_3 | K1: fervura | L1: resfriamento_1 | M1: resfriamento_2 | N1: resfriamento_3 | O1: maturacao | P1: pasteuriacao_rapida | Q1: tunel_pasteurizacao | S1: dados originais | T1: maceracao | U1: cozimento_1 | V1: cozimento_2 | W1: cozimento_3 | X1: moagem | Y1: brassagem_1 | Z1: brassagem_2 | AA1: brassagem_3 | AB1: fervura | AC1: resfriamento_1 | AD1: resfriamento_2 | AE1: resfriamento_3 | AF1: maturacao | AG1: pasteuriacao_rapida | AH1: tunel_pasteurizacao
A2: 2 | B2: 2023-05-04 14:38:52 | C2: 19.77 | D2: 54.77 | E2: 76.77 | F2: 91.77 | G2: 71.77 | H2: 43.77 | I2: 66.77 | J2: 71.77 | K2: 105.77 | L2: 11.77 | M2: 17.77 | N2: 10.77 | O2: 6.77 | P2: 71.77 | Q2: 11.77 | S2: =RC[-16]+8 -> 27.77 | T2: =(C[-1]*1.22) - 19.14 -> 14.739399999999996 | U2: =(C[-2]*0.81) +27.23 -> 49.723700000000001 | V2: =(C[-3]*2.04) + 18.09 -> 74.740799999999993 | W2: =(C[-4]* 6.14)  - 80.71 -> 89.797799999999981 | X2: =(C[-5]*4.09)  - 41.81 -> 71.769299999999987 | Y2: =(C[-6]*2.04)- 16.9 -> 39.750799999999998 | Z2: =(C[-7]*6.14)  - 100.71 -> 69.797799999999981 | AA2: =(C[-8]*2.04) + 10.09 -> 66.740799999999993 | AB2: =(C[-9]*0.81) + 79.23 -> 101.72370000000001 | AC2: =(C[-10]*2.04) - 44.9 -> 11.750799999999998 | AD2: =(C[-11]*2.04) - 39.9 -> 16.750799999999998 | AE2: =(C[-12]*0.81) - 16.76 -> 5.7336999999999989 | AF2: =(C[-13]*0.81) - 20.76 -> 1.7336999999999989 | AG2: =(C[-14]*4.09) - 43.81 -> 69.769299999999987 | AH2: =(C[-15]*2.04) - 49.9 -> 6.7507999999999981
A3: 32 | B3: 2023-05-04 14:41:08 | C3: 19.77 | D3: 54.77 | E3: 76.77 | F3: 91.77 | G3: 71.77 | H3: 43.77 | I3: 66.77 | J3: 71.77 | K3: 105.77 | L3: 11.77 | M3: 17.77 | N3: 10.77 | O3: 6.77 | P3: 71.77 | Q3: 11.77 | S3: =RC[-16]+8 -> 27.77 | T3: =(C[-1]*1.22) - 19.14 -> 14.739399999999996 | U3: =(C[-2]*0.81) +27.23 -> 49.723700000000001 | V3: =(C[-3]*2.04) + 18.09 -> 74.740799999999993 | W3: =(C[-4]* 6.14)  - 80.71 -> 89.797799999999981 | X3: =(C[-5]*4.09)  - 41.81 -> 71.769299999999987 | Y3: =(C[-6]*2.04)- 16.9 -> 39.750799999999998 | Z3: =(C[-7]*6.14)  - 100.71 -> 69.797799999999981 | AA3: =(C[-8]*2.04) + 10.09 -> 66.740799999999993 | AB3: =(C[-9]*0.81) + 79.23 -> 101.72370000000001 | AC3: =(C[-10]*2.04) - 44.9 -> 11.750799999999998 | AD3: =(C[-11]*2.04) - 39.9 -> 16.750799999999998 | AE3: =(C[-12]*0.81) - 16.76 -> 5.7336999999999989 | AF3: =(C[-13]*0.81) - 20.76 -> 1.7336999999999989 | AG3: =(C[-14]*4.09) - 43.81 -> 69.769299999999987 | AH3: =(C[-15]*2.04) - 49.9 -> 6.7507999999999981
A4: 35 | B4: 2023-05-04 14:41:14 | C4: 19.77 | D4: 54.77 | E4: 76.77 | F4: 91.77 | G4: 71.77 | H4: 43.77 | I4: 66.77 | J4: 71.77 | K4: 105.77 | L4: 11.77 | M4: 17.77 | N4: 10.77 | O4: 6.77 | P4: 71.77 | Q4: 11.77 | S4: =RC[-16]+8 -> 27.77 | T4: =(C[-1]*1.22) - 19.14 -> 14.739399999999996 | U4: =(C[-2]*0.81) +27.23 -> 49.723700000000001 | V4: =(C[-3]*2.04) + 18.09 -> 74.740799999999993 | W4: =(C[-4]* 6.14)  - 80.71 -> 89.797799999999981 | X4: =(C[-5]*4.09)  - 41.81 -> 71.769299999999987 | Y4: =(C[-6]*2.04)- 16.9 -> 39.750799999999998 | Z4: =(C[-7]*6.14)  - 100.71 -> 69.797799999999981 | AA4: =(C[-8]*2.04) + 10.09 -> 66.740799999999993 | AB4: =(C[-9]*0.81) + 79.23 -> 101.72370000000001 | AC4: =(C[-10]*2.04) - 44.9 -> 11.750799999999998 | AD4: =(C[-11]*2.04) - 39.9 -> 16.750799999999998 | AE4: =(C[-12]*0.81) - 16.76 -> 5.7336999999999989 | AF4: =(C[-13]*0.81) - 20.76 -> 1.7336999999999989 | AG4: =(C[-14]*4.09) - 43.81 -> 69.769299999999987 | AH4: =(C[-15]*2.04) - 49.9 -> 6.7507999999999981
A5: 36 | B5: 2023-05-04 14:41:16 | C5: 19.77 | D5: 54.77 | E5: 76.77 | F5: 91.77 | G5: 71.77 | H5: 43.77 | I5: 66.77 | J5: 71.77 | K5: 105.77 | L5: 11.77 | M5: 17.77 | N5: 10.77 | O5: 6.77 | P5: 71.77 | Q5: 11.77 | S5: =RC[-16]+8 -> 27.77 | T5: =(C[-1]*1.22) - 19.14 -> 14.739399999999996 | U5: =(C[-2]*0.81) +27.23 -> 49.723700000000001 | V5: =(C[-3]*2.04) + 18.09 -> 74.740799999999993 | W5: =(C[-4]* 6.14)  - 80.71 -> 89.797799999999981 | X5: =(C[-5]*4.09)  - 41.81 -> 71.769299999999987 | Y5: =(C[-6]*2.04)- 16.9 -> 39.750799999999998 | Z5: =(C[-7]*6.14)  - 100.71 -> 69.797799999999981 | AA5: =(C[-8]*2.04) + 10.09 -> 66.740799999999993 | AB5: =(C[-9]*0.81) + 79.23 -> 101.72370000000001 | AC5: =(C[-10]*2.04) - 44.9 -> 11.750799999999998 | AD5: =(C[-11]*2.04) - 39.9 -> 16.750799999999998 | AE5: =(C[-12]*0.81) - 16.76 -> 5.7336999999999989 | AF5: =(C[-13]*0.81) - 20.76 -> 1.7336999999999989 | AG5: =(C[-14]*4.09) - 43.81 -> 69.769299999999987 | AH5: =(C[-15]*2.04) - 49.9 -> 6.7507999999999981
A6: 37 | B6: 2023-05-04 14:41:18 | C6: 19.77 | D6: 54.77 | E6: 76.77 | F6: 91.77 | G6: 71.77 | H6: 43.77 | I6: 66.77 | J6: 71.77 | K6: 105.77 | L6: 11.77 | M6: 17.77 | N6: 10.77 | O6: 6.77 | P6: 71.77 | Q6: 11.77 | S6: =RC[-16]+8 -> 27.77 | T6: =(C[-1]*1.22) - 19.14 -> 14.739399999999996 | U6: =(C[-2]*0.81) +27.23 -> 49.723700000000001 | V6: =(C[-3]*2.04) + 18.09 -> 74.740799999999993 | W6: =(C[-4]* 6.14)  - 80.71 -> 89.797799999999981 | X6: =(C[-5]*4.09)  - 41.81 -> 71.769299999999987 | Y6: =(C[-6]*2.04)- 16.9 -> 39.750799999999998 | Z6: =(C[-7]*6.14)  - 100.71 -> 69.797799999999981 | AA6: =(C[-8]*2.04) + 10.09 -> 66.740799999999993 | AB6: =(C[-9]*0.81) + 79.23 -> 101.72370000000001 | AC6: =(C[-10]*2.04) - 44.9 -> 11.750799999999998 | AD6: =(C[-11]*2.04) - 39.9 -> 16.750799999999998 | AE6: =(C[-12]*0.81) - 16.76 -> 5.7336999999999989 | AF6: =(C[-13]*0.81) - 20.76 -> 1.7336999999999989 | AG6: =(C[-14]*4.09) - 43.81 -> 69.769299999999987 | AH6: =(C[-15]*2.04) - 49.9 -> 6.7507999999999981
A7: 40 | B7: 2023-05-04 14:41:24 | C7: 19.77 | D7: 54.77 | E7: 76.77 | F7: 91.77 | G7: 71.77 | H7: 43.77 | I7: 66.77 | J7: 71.77 | K7: 105.77 | L7: 11.77 | M7: 17.77 | N7: 10.77 | O7: 6.77 | P7: 71.77 | Q7: 11.77 | R7: 0 | S7: =RC[-16]+8 -> 27.77 | T7: =R[1]C -> 14.141599999999997 | U7: =(C[-2]*0.81) +27.23 -> 49.723700000000001 | V7: =(C[-3]*2.04) + 18.09 -> 74.740799999999993 | W7: =(C[-4]* 6.14)  - 80.71 -> 89.797799999999981 | X7: =(C[-5]*4.09)  - 41.81 -> 71.769299999999987 | Y7: =(C[-6]*2.04)- 16.9 -> 39.750799999999998 | Z7: =(C[-7]*6.14)  - 100.71 -> 69.797799999999981 | AA7: =(C[-8]*2.04) + 10.09 -> 66.740799999999993 | AB7: =(C[-9]*0.81) + 79.23 -> 101.72370000000001 | AC7: =(C[-10]*2.04) - 44.9 -> 11.750799999999998 | AD7: =(C[-11]*2.04) - 39.9 -> 16.750799999999998 | AE7: =(C[-12]*0.81) - 16.76 -> 5.7336999999999989 | AF7: =(C[-13]*0.81) - 20.76 -> 1.7336999999999989 | AG7: =(C[-14]*4.09) - 43.81 -> 69.769299999999987 | AH7: =(C[-15]*2.04) - 49.9 -> 6.7507999999999981
A8: 1 | B8: 2023-05-04 14:38:50 | C8: 19.28 | D8: 54.28 | E8: 76.28 | F8: 91.28 | G8: 71.28 | H8: 43.28 | I8: 66.28 | J8: 71.28 | K8: 105.28 | L8: 11.28 | M8: 17.28 | N8: 10.28 | O8: 6.28 | P8: 71.28 | Q8: 11.28 | S8: =RC[-16]+8 -> 27.28 | T8: =(C[-1]*1.22) - 19.14 -> 14.141599999999997 | U8: =(C[-2]*0.81) +27.23 -> 49.326800000000006 | V8: =(C[-3]*2.04) + 18.09 -> 73.741200000000006 | W8: =(C[-4]* 6.14)  - 80.71 -> 86.789200000000008 | X8: =(C[-5]*4.09)  - 41.81 -> 69.765199999999993 | Y8: =(C[-6]*2.04)- 16.9 -> 38.751200000000004 | Z8: =(C[-7]*6.14)  - 100.71 -> 66.789200000000008 | AA8: =(C[-8]*2.04) + 10.09 -> 65.741200000000006 | AB8: =(C[-9]*0.81) + 79.23 -> 101.32680000000001 | AC8: =(C[-10]*2.04) - 44.9 -> 10.751200000000004 | AD8: =(C[-11]*2.04) - 39.9 -> 15.751200000000004 | AE8: =(C[-12]*0.81) - 16.76 -> 5.3368000000000002 | AF8: =(C[-13]*0.81) - 20.76 -> 1.3368000000000002 | AG8: =(C[-14]*4.09) - 43.81 -> 67.765199999999993 | AH8: =(C[-15]*2.04) - 49.9 -> 5.7512000000000043
A9: 4 | B9: 2023-05-04 14:38:56 | C9: 19.28 | D9: 54.28 | E9: 76.28 | F9: 91.28 | G9: 71.28 | H9: 43.28 | I9: 66.28 | J9: 71.28 | K9: 105.28 | L9: 11.28 | M9: 17.28 | N9: 10.28 | O9: 6.28 | P9: 71.28 | Q9: 11.28 | S9: =RC[-16]+8 -> 27.28 | T9: =(C[-1]*1.22) - 19.14 -> 14.141599999999997 | U9: =(C[-2]*0.81) +27.23 -> 49.326800000000006 | V9: =(C[-3]*2.04) + 18.09 -> 73.741200000000006 | W9: =(C[-4]* 6.14)  - 80.71 -> 86.789200000000008 | X9: =(C[-5]*4.09)  - 41.81 -> 69.765199999999993 | Y9: =(C[-6]*2.04)- 16.9 -> 38.751200000000004 | Z9: =(C[-7]*6.14)  - 100.71 -> 66.789200000000008 | AA9: =(C[-8]*2.04) + 10.09 -> 65.741200000000006 | AB9: =(C[-9]*0.81) + 79.23 -> 101.32680000000001 | AC9: =(C[-10]*2.04) - 44.9 -> 10.751200000000004 | AD9: =(C[-11]*2.04) - 39.9 -> 15.751200000000004 | AE9: =(C[-12]*0.81) - 16.76 -> 5.3368000000000002 | AF9: =(C[-13]*0.81) - 20.76 -> 1.3368000000000002 | AG9: =(C[-14]*4.09) - 43.81 -> 67.765199999999993 | AH9: =(C[-15]*2.04) - 49.9 -> 5.7512000000000043
A10: 5 | B10: 2023-05-04 14:38:58 | C10: 19.28 | D10: 54.28 | E10: 76.28 | F10: 91.28 | G10: 71.28 | H10: 43.28 | I10: 66.28 | J10: 71.28 | K10: 105.28 | L10: 11.28 | M10: 17.28 | N10: 10.28 | O10: 6.28 | P10: 71.28 | Q10: 11.28 | S10: =RC[-16]+8 -> 27.28 | T10: =(C[-1]*1.22) - 19.14 -> 14.141599999999997 | U10: =(C[-2]*0.81) +27.23 -> 49.326800000000006 | V10: =(C[-3]*2.04) + 18.09 -> 73.741200000000006 | W10: =(C[-4]* 6.14)  - 80.71 -> 86.789200000000008 | X10: =(C[-5]*4.09)  - 41.81 -> 69.765199999999993 | Y10: =(C[-6]*2.04)- 16.9 -> 38.751200000000004 | Z10: =(C[-7]*6.14)  - 100.71 -> 66.789200000000008 | AA10: =(C[-8]*2.04) + 10.09 -> 65.741200000000006 | AB10: =(C[-9]*0.81) + 79.23 -> 101.32680000000001 | AC10: =(C[-10]*2.04) - 44.9 -> 10.751200000000004 | AD10: =(C[-11]*2.04) - 39.9 -> 15.751200000000004 | AE10: =(C[-12]*0.81) - 16.76 -> 5.3368000000000002 | AF10: =(C[-13]*0.81) - 20.76 -> 1.3368000000000002 | AG10: =(C[-14]*4.09) - 43.81 -> 67.765199999999993 | AH10: =(C[-15]*2.04) - 49.9 -> 5.7512000000000043
A11: 6 | B11: 2023-05-04 14:39:00 | C11: 19.28 | D11: 54.28 | E11: 76.28 | F11: 91.28 | G11: 71.28 | H11: 43.28 | I11: 66.28 | J11: 71.28 | K11: 105.28 | L11: 11.28 | M11: 17.28 | N11: 10.28 | O11: 6.28 | P11: 71.28 | Q11: 11.28 | S11: =RC[-16]+8 -> 27.28 | T11: =(C[-1]*1.22) - 19.14 -> 14.141599999999997 | U11: =(C[-2]*0.81) +27.23 -> 49.326800000000006 | V11: =(C[-3]*2.04) + 18.09 -> 73.741200000000006 | W11: =(C[-4]* 6.14)  - 80.71 -> 86.789200000000008 | X11: =(C[-5]*4.09)  - 41.81 -> 69.765199999999993 | Y11: =(C[-6]*2.04)- 16.9 -> 38.751200000000004 | Z11: =(C[-7]*6.14)  - 100.71 -> 66.789200000000008 | AA11: =(C[-8]*2.04) + 10.09 -> 65.741200000000006 | AB11: =(C[-9]*0.81) + 79.23 -> 101.32680000000001 | AC11: =(C[-10]*2.04) - 44.9 -> 10.751200000000004 | AD11: =(C[-11]*2.04) - 39.9 -> 15.751200000000004 | AE11: =(C[-12]*0.81) - 16.76 -> 5.3368000000000002 | AF11: =(C[-13]*0.81) - 20.76 -> 1.3368000000000002 | AG11: =(C[-14]*4.09) - 43.81 -> 67.765199999999993 | AH11: =(C[-15]*2.04) - 49.9 -> 5.7512000000000043
A12: 8 | B12: 2023-05-04 14:39:04 | C12: 19.28 | D12: 54.28 | E12: 76.28 | F12: 91.28 | G12: 71.28 | H12: 43.28 | I12: 66.28 | J12: 71.28 | K12: 105.28 | L12: 11.28 | M12: 17.28 | N12: 10.28 | O12: 6.28 | P12: 71.28 | Q12: 11.28 | S12: =RC[-16]+8 -> 27.28 | T12: =(C[-1]*1.22) - 19.14 -> 14.141599999999997 | U12: =(C[-2]*0.81) +27.23 -> 49.326800000000006 | V12: =(C[-3]*2.04) + 18.09 -> 73.741200000000006 | W12: =(C[-4]* 6.14)  - 80.71 -> 86.789200000000008 | X12: =(C[-5]*4.09)  - 41.81 -> 69.765199999999993 | Y12: =(C[-6]*2.04)- 16.9 -> 38.751200000000004 | Z12: =(C[-7]*6.14)  - 100.71 -> 66.789200000000008 | AA12: =(C[-8]*2.04) + 10.09 -> 65.741200000000006 | AB12: =(C[-9]*0.81) + 79.23 -> 101.32680000000001 | AC12: =(C[-10]*2.04) - 44.9 -> 10.751200000000004 | AD12: =(C[-11]*2.04) - 39.9 -> 15.751200000000004 | AE12: =(C[-12]*0.81) - 16.76 -> 5.3368000000000002 | AF12: =(C[-13]*0.81) - 20.76 -> 1.3368000000000002 | AG12: =(C[-14]*4.09) - 43.81 -> 67.765199999999993 | AH12: =(C[-15]*2.04) - 49.9 -> 5.7512000000000043
A13: 9 | B13: 2023-05-04 14:39:06 | C13: 19.28 | D13: 54.28 | E13: 76.28 | F13: 91.28 | G13: 71.28 | H13: 43.28 | I13: 66.28 | J13: 71.28 | K13: 105.28 | L13: 11.28 | M13: 17.28 | N13: 10.28 | O13: 6.28 | P13: 71.28 | Q13: 11.28 | S13: =RC[-16]+8 -> 27.28 | T13: =(C[-1]*1.22) - 19.14 -> 14.141599999999997 | U13: =(C[-2]*0.81) +27.23 -> 49.326800000000006 | V13: =(C[-3]*2.04) + 18.09 -> 73.741200000000006 | W13: =(C[-4]* 6.14)  - 80.71 -> 86.789200000000008 | X13: =(C[-5]*4.09)  - 41.81 -> 69.765199999999993 | Y13: =(C[-6]*2.04)- 16.9 -> 38.751200000000004 | Z13: =(C[-7]*6.14)  - 100.71 -> 66.789200000000008 | AA13: =(C[-8]*2.04) + 10.09 -> 65.741200000000006 | AB13: =(C[-9]*0.81) + 79.23 -> 101.32680000000001 | AC13: =(C[-10]*2.04) - 44.9 -> 10.751200000000004 | AD13: =(C[-11]*2.04) - 39.9 -> 15.751200000000004 | AE13: =(C[-12]*0.81) - 16.76 -> 5.3368000000000002 | AF13: =(C[-13]*0.81) - 20.76 -> 1.3368000000000002 | AG13: =(C[-14]*4.09) - 43.81 -> 67.765199999999993 | AH13: =(C[-15]*2.04) - 49.9 -> 5.7512000000000043
A14: 11 | B14: 2023-05-04 14:39:10 | C14: 19.28 | D14: 54.28 | E14: 76.28 | F14: 91.28 | G14: 71.28 | H14: 43.28 | I14: 66.28 | J14: 71.28 | K14: 105.28 | L14: 11.28 | M14: 17.28 | N14: 10.28 | O14: 6.28 | P14: 71.28 | Q14: 11.28 | S14: =RC[-16]+8 -> 27.28 | T14: =(C[-1]*1.22) - 19.14 -> 14.141599999999997 | U14: =(C[-2]*0.81) +27.23 -> 49.326800000000006 | V14: =(C[-3]*2.04) + 18.09 -> 73.741200000000006 | W14: =(C[-4]* 6.14)  - 80.71 -> 86.789200000000008 | X14: =(C[-5]*4.09)  - 41.81 -> 69.765199999999993 | Y14: =(C[-6]*2.04)- 16.9 -> 38.751200000000004 | Z14: =(C[-7]*6.14)  - 100.71 -> 66.789200000000008 | AA14: =(C[-8]*2.04) + 10.09 -> 65.741200000000006 | AB14: =(C[-9]*0.81) + 79.23 -> 101.32680000000001 | AC14: =(C[-10]*2.04) - 44.9 -> 10.751200000000004 | AD14: =(C[-11]*2.04) - 39.9 -> 15.751200000000004 | AE14: =(C[-12]*0.81) - 16.76 -> 5.3368000000000002 | AF14: =(C[-13]*0.81) - 20.76 -> 1.3368000000000002 | AG14: =(C[-14]*4.09) - 43.81 -> 67.765199999999993 | AH14: =(C[-15]*2.04) - 49.9 -> 5.7512000000000043
A15: 12 | B15: 2023-05-04 14:39:12 | C15: 19.28 | D15: 54.28 | E15: 76.28 | F15: 91.28 | G15: 71.28 | H15: 43.28 | I15: 66.28 | J15: 71.28 | K15: 105.28 | L15: 11.28 | M15: 17.28 | N15: 10.28 | O15: 6.28 | P15: 71.28 | Q15: 11.28 | S15: =RC[-16]+8 -> 27.28 | T15: =(C[-1]*1.22) - 19.14 -> 14.141599999999997 | U15: =(C[-2]*0.81) +27.23 -> 49.326800000000006 | V15: =(C[-3]*2.04) + 18.09 -> 73.741200000000006 | W15: =(C[-4]* 6.14)  - 80.71 -> 86.789200000000008 | X15: =(C[-5]*4.09)  - 41.81 -> 69.765199999999993 | Y15: =(C[-6]*2.04)- 16.9 -> 38.751200000000004 | Z15: =(C[-7]*6.14)  - 100.71 -> 66.789200000000008 | AA15: =(C[-8]*2.04) + 10.09 -> 65.741200000000006 | AB15: =(C[-9]*0.81) + 79.23 -> 101.32680000000001 | AC15: =(C[-10]*2.04) - 44.9 -> 10.751200000000004 | AD15: =(C[-11]*2.04) - 39.9 -> 15.751200000000004 | AE15: =(C[-12]*0.81) - 16.76 -> 5.3368000000000002 | AF15: =(C[-13]*0.81) - 20.76 -> 1.3368000000000002 | AG15: =(C[-14]*4.09) - 43.81 -> 67.765199999999993 | AH15: =(C[-15]*2.04) - 49.9 -> 5.7512000000000043
A16: 13 | B16: 2023-05-04 14:39:14 | C16: 19.28 | D16: 54.28 | E16: 76.28 | F16: 91.28 | G16: 71.28 | H16: 43.28 | I16: 66.28 | J16: 71.28 | K16: 105.28 | L16: 11.28 | M16: 17.28 | N16: 10.28 | O16: 6.28 | P16: 71.28 | Q16: 11.28 | S16: =RC[-16]+8 -> 27.28 | T16: =(C[-1]*1.22) - 19.14 -> 14.141599999999997 | U16: =(C[-2]*0.81) +27.23 -> 49.326800000000006 | V16: =(C[-3]*2.04) + 18.09 -> 73.741200000000006 | W16: =(C[-4]* 6.14)  - 80.71 -> 86.789200000000008 | X16: =(C[-5]*4.09)  - 41.81 -> 69.765199999999993 | Y16: =(C[-6]*2.04)- 16.9 -> 38.751200000000004 | Z16: =(C[-7]*6.14)  - 100.71 -> 66.789200000000008 | AA16: =(C[-8]*2.04) + 10.09 -> 65.741200000000006 | AB16: =(C[-9]*0.81) + 79.23 -> 101.32680000000001 | AC16: =(C[-10]*2.04) - 44.9 -> 10.751200000000004 | AD16: =(C[-11]*2.04) - 39.9 -> 15.751200000000004 | AE16: =(C[-12]*0.81) - 16.76 -> 5.3368000000000002 | AF16: =(C[-13]*0.81) - 20.76 -> 1.3368000000000002 | AG16: =(C[-14]*4.09) - 43.81 -> 67.765199999999993 | AH16: =(C[-15]*2.04) - 49.9 -> 5.7512000000000043
A17: 14 | B17: 2023-05-04 14:39:16 | C17: 19.28 | D17: 54.28 | E17: 76.28 | F17: 91.28 | G17: 71.28 | H17: 43.28 | I17: 66.28 | J17: 71.28 | K17: 105.28 | L17: 11.28 | M17: 17.28 | N17: 10.28 | O17: 6.28 | P17: 71.28 | Q17: 11.28 | S17: =RC[-16]+8 -> 27.28 | T17: =(C[-1]*1.22) - 19.14 -> 14.141599999999997 | U17: =(C[-2]*0.81) +27.23 -> 49.326800000000006 | V17: =(C[-3]*2.04) + 18.09 -> 73.741200000000006 | W17: =(C[-4]* 6.14)  - 80.71 -> 86.789200000000008 | X17: =(C[-5]*4.09)  - 41.81 -> 69.765199999999993 | Y17: =(C[-6]*2.04)- 16.9 -> 38.751200000000004 | Z17: =(C[-7]*6.14)  - 100.71 -> 66.789200000000008 | AA17: =(C[-8]*2.04) + 10.09 -> 65.741200000000006 | AB17: =(C[-9]*0.81) + 79.23 -> 101.32680000000001 | AC17: =(C[-10]*2.04) - 44.9 -> 10.751200000000004 | AD17: =(C[-11]*2.04) - 39.9 -> 15.751200000000004 | AE17: =(C[-12]*0.81) - 16.76 -> 5.3368000000000002 | AF17: =(C[-13]*0.81) - 20.76 -> 1.3368000000000002 | AG17: =(C[-14]*4.09) - 43.81 -> 67.765199999999993 | AH17: =(C[-15]*2.04) - 49.9 -> 5.7512000000000043
A18: 15 | B18: 2023-05-04 14:39:18 | C18: 19.28 | D18: 54.28 | E18: 76.28 | F18: 91.28 | G18: 71.28 | H18: 43.28 | I18: 66.28 | J18: 71.28 | K18: 105.28 | L18: 11.28 | M18: 17.28 | N18: 10.28 | O18: 6.28 | P18: 71.28 | Q18: 11.28 | S18: =RC[-16]+8 -> 27.28 | T18: =(C[-1]*1.22) - 19.14 -> 14.141599999999997 | U18: =(C[-2]*0.81) +27.23 -> 49.326800000000006 | V18: =(C[-3]*2.04) + 18.09 -> 73.741200000000006 | W18: =(C[-4]* 6.14)  - 80.71 -> 86.789200000000008 | X18: =(C[-5]*4.09)  - 41.81 -> 69.765199999999993 | Y18: =(C[-6]*2.04)- 16.9 -> 38.751200000000004 | Z18: =(C[-7]*6.14)  - 100.71 -> 66.789200000000008 | AA18: =(C[-8]*2.04) + 10.09 -> 65.741200000000006 | AB18: =(C[-9]*0.81) + 79.23 -> 101.32680000000001 | AC18: =(C[-10]*2.04) - 44.9 -> 10.751200000000004 | AD18: =(C[-11]*2.04) - 39.9 -> 15.751200000000004 | AE18: =(C[-12]*0.81) - 16.76 -> 5.3368000000000002 | AF18: =(C[-13]*0.81) - 20.76 -> 1.3368000000000002 | AG18: =(C[-14]*4.09) - 43.81 -> 67.765199999999993 | AH18: =(C[-15]*2.04) - 49.9 -> 5.7512000000000043
A19: 16 | B19: 2023-05-04 14:39:20 | C19: 19.28 | D19: 54.28 | E19: 76.28 | F19: 91.28 | G19: 71.28 | H19: 43.28 | I19: 66.28 | J19: 71.28 | K19: 105.28 | L19: 11.28 | M19: 17.28 | N19: 10.28 | O19: 6.28 | P19: 71.28 | Q19: 11.28 | S19: =RC[-16]+8 -> 27.28 | T19: =(C[-1]*1.22) - 19.14 -> 14.141599999999997 | U19: =(C[-2]*0.81) +27.23 -> 49.326800000000006 | V19: =(C[-3]*2.04) + 18.09 -> 73.741200000000006 | W19: =(C[-4]* 6.14)  - 80.71 -> 86.789200000000008 | X19: =(C[-5]*4.09)  - 41.81 -> 69.765199999999993 | Y19: =(C[-6]*2.04)- 16.9 -> 38.751200000000004 | Z19: =(C[-7]*6.14)  - 100.71 -> 66.789200000000008 | AA19: =(C[-8]*2.04) + 10.09 -> 65.741200000000006 | AB19: =(C[-9]*0.81) + 79.23 -> 101.32680000000001 | AC19: =(C[-10]*2.04) - 44.9 -> 10.751200000000004 | AD19: =(C[-11]*2.04) - 39.9 -> 15.751200000000004 | AE19: =(C[-12]*0.81) - 16.76 -> 5.3368000000000002 | AF19: =(C[-13]*0.81) - 20.76 -> 1.3368000000000002 | AG19: =(C[-14]*4.09) - 43.81 -> 67.765199999999993 | AH19: =(C[-15]*2.04) - 49.9 -> 5.7512000000000043
A20: 17 | B20: 2023-05-04 14:39:22 | C20: 19.28 | D20: 54.28 | E20: 76.28 | F20: 91.28 | G20: 71.28 | H20: 43.28 | I20: 66.28 | J20: 71.28 | K20: 105.28 | L20: 11.28 | M20: 17.28 | N20: 10.28 | O20: 6.28 | P20: 71.28 | Q20: 11.28 | S20: =RC[-16]+8 -> 27.28 | T20: =(C[-1]*1.22) - 19.14 -> 14.141599999999997 | U20: =(C[-2]*0.81) +27.23 -> 49.326800000000006 | V20: =(C[-3]*2.04) + 18.09 -> 73.741200000000006 | W20: =(C[-4]* 6.14)  - 80.71 -> 86.789200000000008 | X20: =(C[-5]*4.09)  - 41.81 -> 69.765199999999993 | Y20: =(C[-6]*2.04)- 16.9 -> 38.751200000000004 | Z20: =(C[-7]*6.14)  - 100.71 -> 66.789200000000008 | AA20: =(C[-8]*2.04) + 10.09 -> 65.741200000000006 | AB20: =(C[-9]*0.81) + 79.23 -> 101.32680000000001 | AC20: =(C[-10]*2.04) - 44.9 -> 10.751200000000004 | AD20: =(C[-11]*2.04) - 39.9 -> 15.751200000000004 | AE20: =(C[-12]*0.81) - 16.76 -> 5.3368000000000002 | AF20: =(C[-13]*0.81) - 20.76 -> 1.3368000000000002 | AG20: =(C[-14]*4.09) - 43.81 -> 67.765199999999993 | AH20: =(C[-15]*2.04) - 49.9 -> 5.7512000000000043
A21: 18 | B21: 2023-05-04 14:39:24 | C21: 19.28 | D21: 54.28 | E21: 76.28 | F21: 91.28 | G21: 71.28 | H21: 43.28 | I21: 66.28 | J21: 71.28 | K21: 105.28 | L21: 11.28 | M21: 17.28 | N21: 10.28 | O21: 6.28 | P21: 71.28 | Q21: 11.28 | S21: =RC[-16]+8 -> 27.28 | T21: =(C[-1]*1.22) - 19.14 -> 14.141599999999997 | U21: =(C[-2]*0.81) +27.23 -> 49.326800000000006 | V21: =(C[-3]*2.04) + 18.09 -> 73.741200000000006 | W21: =(C[-4]* 6.14)  - 80.71 -> 86.789200000000008 | X21: =(C[-5]*4.09)  - 41.81 -> 69.765199999999993 | Y21: =(C[-6]*2.04)- 16.9 -> 38.751200000000004 | Z21: =(C[-7]*6.14)  - 100.71 -> 66.789200000000008 | AA21: =(C[-8]*2.04) + 10.09 -> 65.741200000000006 | AB21: =(C[-9]*0.81) + 79.23 -> 101.32680000000001 | AC21: =(C[-10]*2.04) - 44.9 -> 10.751200000000004 | AD21: =(C[-11]*2.04) - 39.9 -> 15.751200000000004 | AE21: =(C[-12]*0.81) - 16.76 -> 5.3368000000000002 | AF21: =(C[-13]*0.81) - 20.76 -> 1.3368000000000002 | AG21: =(C[-14]*4.09) - 43.81 -> 67.765199999999993 | AH21: =(C[-15]*2.04) - 49.9 -> 5.7512000000000043
A22: 19 | B22: 2023-05-04 14:39:26 | C22: 19.28 | D22: 54.28 | E22: 76.28 | F22: 91.28 | G22: 71.28 | H22: 43.28 | I22: 66.28 | J22: 71.28 | K22: 105.28 | L22: 11.28 | M22: 17.28 | N22: 10.28 | O22: 6.28 | P22: 71.28 | Q22: 11.28 | S22: =RC[-16]+8 -> 27.28 | T22: =(C[-1]*1.22) - 19.14 -> 14.141599999999997 | U22: =(C[-2]*0.81) +27.23 -> 49.326800000000006 | V22: =(C[-3]*2.04) + 18.09 -> 73.741200000000006 | W22: =(C[-4]* 6.14)  - 80.71 -> 86.789200000000008 | X22: =(C[-5]*4.09)  - 41.81 -> 69.765199999999993 | Y22: =(C[-6]*2.04)- 16.9 -> 38.751200000000004 | Z22: =(C[-7]*6.14)  - 100.71 -> 66.789200000000008 | AA22: =(C[-8]*2.04) + 10.09 -> 65.741200000000006 | AB22: =(C[-9]*0.81) + 79.23 -> 101.32680000000001 | AC22: =(C[-10]*2.04) - 44.9 -> 10.751200000000004 | AD22: =(C[-11]*2.04) - 39.9 -> 15.751200000000004 | AE22: =(C[-12]*0.81) - 16.76 -> 5.3368000000000002 | AF22: =(C[-13]*0.81) - 20.76 -> 1.3368000000000002 | AG22: =(C[-14]*4.09) - 43.81 -> 67.765199999999993 | AH22: =(C[-15]*2.04) - 49.9 -> 5.7512000000000043
A23: 20 | B23: 2023-05-04 14:39:28 | C23: 19.28 | D23: 54.28 | E23: 76.28 | F23: 91.28 | G23: 71.28 | H23: 43.28 | I23: 66.28 | J23: 71.28 | K23: 105.28 | L23: 11.28 | M23: 17.28 | N23: 10.28 | O23: 6.28 | P23: 71.28 | Q23: 11.28 | S23: =RC[-16]+8 -> 27.28 | T23: =(C[-1]*1.22) - 19.14 -> 14.141599999999997 | U23: =(C[-2]*0.81) +27.23 -> 49.326800000000006 | V23: =(C[-3]*2.04) + 18.09 -> 73.741200000000006 | W23: =(C[-4]* 6.14)  - 80.71 -> 86.789200000000008 | X23: =(C[-5]*4.09)  - 41.81 -> 69.765199999999993 | Y23: =(C[-6]*2.04)- 16.9 -> 38.751200000000004 | Z23: =(C[-7]*6.14)  - 100.71 -> 66.789200000000008 | AA23: =(C[-8]*2.04) + 10.09 -> 65.741200000000006 | AB23: =(C[-9]*0.81) + 79.23 -> 101.32680000000001 | AC23: =(C[-10]*2.04) - 44.9 -> 10.751200000000004 | AD23: =(C[-11]*2.04) - 39.9 -> 15.751200000000004 | AE23: =(C[-12]*0.81) - 16.76 -> 5.3368000000000002 | AF23: =(C[-13]*0.81) - 20.76 -> 1.3368000000000002 | AG23: =(C[-14]*4.09) - 43.81 -> 67.765199999999993 | AH23: =(C[-15]*2.04) - 49.9 -> 5.7512000000000043
A24: 22 | B24: 2023-05-04 14:39:32 | C24: 19.28 | D24: 54.28 | E24: 76.28 | F24: 91.28 | G24: 71.28 | H24: 43.28 | I24: 66.28 | J24: 71.28 | K24: 105.28 | L24: 11.28 | M24: 17.28 | N24: 10.28 | O24: 6.28 | P24: 71.28 | Q24: 11.28 | S24: =RC[-16]+8 -> 27.28 | T24: =(C[-1]*1.22) - 19.14 -> 14.141599999999997 | U24: =(C[-2]*0.81) +27.23 -> 49.326800000000006 | V24: =(C[-3]*2.04) + 18.09 -> 73.741200000000006 | W24: =(C[-4]* 6.14)  - 80.71 -> 86.789200000000008 | X24: =(C[-5]*4.09)  - 41.81 -> 69.765199999999993 | Y24: =(C[-6]*2.04)- 16.9 -> 38.751200000000004 | Z24: =(C[-7]*6.14)  - 100.71 -> 66.789200000000008 | AA24: =(C[-8]*2.04) + 10.09 -> 65.741200000000006 | AB24: =(C[-9]*0.81) + 79.23 -> 101.32680000000001 | AC24: =(C[-10]*2.04) - 44.9 -> 10.751200000000004 | AD24: =(C[-11]*2.04) - 39.9 -> 15.751200000000004 | AE24: =(C[-12]*0.81) - 16.76 -> 5.3368000000000002 | AF24: =(C[-13]*0.81) - 20.76 -> 1.3368000000000002 | AG24: =(C[-14]*4.09) - 43.81 -> 67.765199999999993 | AH24: =(C[-15]*2.04) - 49.9 -> 5.7512000000000043
A25: 23 | B25: 2023-05-04 14:39:34 | C25: 19.28 | D25: 54.28 | E25: 76.28 | F25: 91.28 | G25: 71.28 | H25: 43.28 | I25: 66.28 | J25: 71.28 | K25: 105.28 | L25: 11.28 | M25: 17.28 | N25: 10.28 | O25: 6.28 | P25: 71.28 | Q25: 11.28 | S25: =RC[-16]+8 -> 27.28 | T25: =(C[-1]*1.22) - 19.14 -> 14.141599999999997 | U25: =(C[-2]*0.81) +27.23 -> 49.326800000000006 | V25: =(C[-3]*2.04) + 18.09 -> 73.741200000000006 | W25: =(C[-4]* 6.14)  - 80.71 -> 86.789200000000008 | X25: =(C[-5]*4.09)  - 41.81 -> 69.765199999999993 | Y25: =(C[-6]*2.04)- 16.9 -> 38.751200000000004 | Z25: =(C[-7]*6.14)  - 100.71 -> 66.789200000000008 | AA25: =(C[-8]*2.04) + 10.09 -> 65.741200000000006 | AB25: =(C[-9]*0.81) + 79.23 -> 101.32680000000001 | AC25: =(C[-10]*2.04) - 44.9 -> 10.751200000000004 | AD25: =(C[-11]*2.04) - 39.9 -> 15.751200000000004 | AE25: =(C[-12]*0.81) - 16.76 -> 5.3368000000000002 | AF25: =(C[-13]*0.81) - 20.76 -> 1.3368000000000002 | AG25: =(C[-14]*4.09) - 43.81 -> 67.765199999999993 | AH25: =(C[-15]*2.04) - 49.9 -> 5.7512000000000043
A26: 25 | B26: 2023-05-04 14:39:38 | C26: 19.28 | D26: 54.28 | E26: 76.28 | F26: 91.28 | G26: 71.28 | H26: 43.28 | I26: 66.28 | J26: 71.28 | K26: 105.28 | L26: 11.28 | M26: 17.28 | N26: 10.28 | O26: 6.28 | P26: 71.28 | Q26: 11.28 | S26: =RC[-16]+8 -> 27.28 | T26: =(C[-1]*1.22) - 19.14 -> 14.141599999999997 | U26: =(C[-2]*0.81) +27.23 -> 49.326800000000006 | V26: =(C[-3]*2.04) + 18.09 -> 73.741200000000006 | W26: =(C[-4]* 6.14)  - 80.71 -> 86.789200000000008 | X26: =(C[-5]*4.09)  - 41.81 -> 69.765199999999993 | Y26: =(C[-6]*2.04)- 16.9 -> 38.751200000000004 | Z26: =(C[-7]*6.14)  - 100.71 -> 66.789200000000008 | AA26: =(C[-8]*2.04) + 10.09 -> 65.741200000000006 | AB26: =(C[-9]*0.81) + 79.23 -> 101.32680000000001 | AC26: =(C[-10]*2.04) - 44.9 -> 10.751200000000004 | AD26: =(C[-11]*2.04) - 39.9 -> 15.751200000000004 | AE26: =(C[-12]*0.81) - 16.76 -> 5.3368000000000002 | AF26: =(C[-13]*0.81) - 20.76 -> 1.3368000000000002 | AG26: =(C[-14]*4.09) - 43.81 -> 67.765199999999993 | AH26: =(C[-15]*2.04) - 49.9 -> 5.7512000000000043
A27: 26 | B27: 2023-05-04 14:39:40 | C27: 19.28 | D27: 54.28 | E27: 76.28 | F27: 91.28 | G27: 71.28 | H27: 43.28 | I27: 66.28 | J27: 71.28 | K27: 105.28 | L27: 11.28 | M27: 17.28 | N27: 10.28 | O27: 6.28 | P27: 71.28 | Q27: 11.28 | S27: =RC[-16]+8 -> 27.28 | T27: =(C[-1]*1.22) - 19.14 -> 14.141599999999997 | U27: =(C[-2]*0.81) +27.23 -> 49.326800000000006 | V27: =(C[-3]*2.04) + 18.09 -> 73.741200000000006 | W27: =(C[-4]* 6.14)  - 80.71 -> 86.789200000000008 | X27: =(C[-5]*4.09)  - 41.81 -> 69.765199999999993 | Y27: =(C[-6]*2.04)- 16.9 -> 38.751200000000004 | Z27: =(C[-7]*6.14)  - 100.71 -> 66.789200000000008 | AA27: =(C[-8]*2.04) + 10.09 -> 65.741200000000006 | AB27: =(C[-9]*0.81) + 79.23 -> 101.32680000000001 | AC27: =(C[-10]*2.04) - 44.9 -> 10.751200000000004 | AD27: =(C[-11]*2.04) - 39.9 -> 15.751200000000004 | AE27: =(C[-12]*0.81) - 16.76 -> 5.3368000000000002 | AF27: =(C[-13]*0.81) - 20.76 -> 1.3368000000000002 | AG27: =(C[-14]*4.09) - 43.81 -> 67.765199999999993 | AH27: =(C[-15]*2.04) - 49.9 -> 5.7512000000000043
A28: 27 | B28: 2023-05-04 14:39:42 | C28: 19.28 | D28: 54.28 | E28: 76.28 | F28: 91.28 | G28: 71.28 | H28: 43.28 | I28: 66.28 | J28: 71.28 | K28: 105.28 | L28: 11.28 | M28: 17.28 | N28: 10.28 | O28: 6.28 | P28: 71.28 | Q28: 11.28 | S28: =RC[-16]+8 -> 27.28 | T28: =(C[-1]*1.22) - 19.14 -> 14.141599999999997 | U28: =(C[-2]*0.81) +27.23 -> 49.326800000000006 | V28: =(C[-3]*2.04) + 18.09 -> 73.741200000000006 | W28: =(C[-4]* 6.14)  - 80.71 -> 86.789200000000008 | X28: =(C[-5]*4.09)  - 41.81 -> 69.765199999999993 | Y28: =(C[-6]*2.04)- 16.9 -> 38.751200000000004 | Z28: =(C[-7]*6.14)  - 100.71 -> 66.789200000000008 | AA28: =(C[-8]*2.04) + 10.09 -> 65.741200000000006 | AB28: =(C[-9]*0.81) + 79.23 -> 101.32680000000001 | AC28: =(C[-10]*2.04) - 44.9 -> 10.751200000000004 | AD28: =(C[-11]*2.04) - 39.9 -> 15.751200000000004 | AE28: =(C[-12]*0.81) - 16.76 -> 5.3368000000000002 | AF28: =(C[-13]*0.81) - 20.76 -> 1.3368000000000002 | AG28: =(C[-14]*4.09) - 43.81 -> 67.765199999999993 | AH28: =(C[-15]*2.04) - 49.9 -> 5.7512000000000043
A29: 29 | B29: 2023-05-04 14:39:46 | C29: 19.28 | D29: 54.28 | E29: 76.28 | F29: 91.28 | G29: 71.28 | H29: 43.28 | I29: 66.28 | J29: 71.28 | K29: 105.28 | L29: 11.28 | M29: 17.28 | N29: 10.28 | O29: 6.28 | P29: 71.28 | Q29: 11.28 | S29: =RC[-16]+8 -> 27.28 | T29: =(C[-1]*1.22) - 19.14 -> 14.141599999999997 | U29: =(C[-2]*0.81) +27.23 -> 49.326800000000006 | V29: =(C[-3]*2.04) + 18.09 -> 73.741200000000006 | W29: =(C[-4]* 6.14)  - 80.71 -> 86.789200000000008 | X29: =(C[-5]*4.09)  - 41.81 -> 69.765199999999993 | Y29: =(C[-6]*2.04)- 16.9 -> 38.751200000000004 | Z29: =(C[-7]*6.14)  - 100.71 -> 66.789200000000008 | AA29: =(C[-8]*2.04) + 10.09 -> 65.741200000000006 | AB29: =(C[-9]*0.81) + 79.23 -> 101.32680000000001 | AC29: =(C[-10]*2.04) - 44.9 -> 10.751200000000004 | AD29: =(C[-11]*2.04) - 39.9 -> 15.751200000000004 | AE29: =(C[-12]*0.81) - 16.76 -> 5.3368000000000002 | AF29: =(C[-13]*0.81) - 20.76 -> 1.3368000000000002 | AG29: =(C[-14]*4.09) - 43.81 -> 67.765199999999993 | AH29: =(C[-15]*2.04) - 49.9 -> 5.7512000000000043
A30: 30 | B30: 2023-05-04 14:39:48 | C30: 19.28 | D30: 54.28 | E30: 76.28 | F30: 91.28 | G30: 71.28 | H30: 43.28 | I30: 66.28 | J30: 71.28 | K30: 105.28 | L30: 11.28 | M30: 17.28 | N30: 10.28 | O30: 6.28 | P30: 71.28 | Q30: 11.28 | S30: =RC[-16]+8 -> 27.28 | T30: =(C[-1]*1.22) - 19.14 -> 14.141599999999997 | U30: =(C[-2]*0.81) +27.23 -> 49.326800000000006 | V30: =(C[-3]*2.04) + 18.09 -> 73.741200000000006 | W30: =(C[-4]* 6.14)  - 80.71 -> 86.789200000000008 | X30: =(C[-5]*4.09)  - 41.81 -> 69.765199999999993 | Y30: =(C[-6]*2.04)- 16.9 -> 38.751200000000004 | Z30: =(C[-7]*6.14)  - 100.71 -> 66.789200000000008 | AA30: =(C[-8]*2.04) + 10.09 -> 65.741200000000006 | AB30: =(C[-9]*0.81) + 79.23 -> 101.32680000000001 | AC30: =(C[-10]*2.04) - 44.9 -> 10.751200000000004 | AD30: =(C[-11]*2.04) - 39.9 -> 15.751200000000004 | AE30: =(C[-12]*0.81) - 16.76 -> 5.3368000000000002 | AF30: =(C[-13]*0.81) - 20.76 -> 1.3368000000000002 | AG30: =(C[-14]*4.09) - 43.81 -> 67.765199999999993 | AH30: =(C[-15]*2.04) - 49.9 -> 5.7512000000000043
A31: 31 | B31: 2023-05-04 14:39:50 | C31: 19.28 | D31: 54.28 | E31: 76.28 | F31: 91.28 | G31: 71.28 | H31: 43.28 | I31: 66.28 | J31: 71.28 | K31: 105.28 | L31: 11.28 | M31: 17.28 | N31: 10.28 | O31: 6.28 | P31: 71.28 | Q31: 11.28 | S31: =RC[-16]+8 -> 27.28 | T31: =(C[-1]*1.22) - 19.14 -> 14.141599999999997 | U31: =(C[-2]*0.81) +27.23 -> 49.326800000000006 | V31: =(C[-3]*2.04) + 18.09 -> 73.741200000000006 | W31: =(C[-4]* 6.14)  - 80.71 -> 86.789200000000008 | X31: =(C[-5]*4.09)  - 41.81 -> 69.765199999999993 | Y31: =(C[-6]*2.04)- 16.9 -> 38.751200000000004 | Z31: =(C[-7]*6.14)  - 100.71 -> 66.789200000000008 | AA31: =(C[-8]*2.04) + 10.09 -> 65.741200000000006 | AB31: =(C[-9]*0.81) + 79.23 -> 101.32680000000001 | AC31: =(C[-10]*2.04) - 44.9 -> 10.751200000000004 | AD31: =(C[-11]*2.04) - 39.9 -> 15.751200000000004 | AE31: =(C[-12]*0.81) - 16.76 -> 5.3368000000000002 | AF31: =(C[-13]*0.81) - 20.76 -> 1.3368000000000002 | AG31: =(C[-14]*4.09) - 43.81 -> 67.765199999999993 | AH31: =(C[-15]*2.04) - 49.9 -> 5.7512000000000043
A32: 33 | B32: 2023-05-04 14:41:10 | C32: 19.28 | D32: 54.28 | E32: 76.28 | F32: 91.28 | G32: 71.28 | H32: 43.28 | I32: 66.28 | J32: 71.28 | K32: 105.28 | L32: 11.28 | M32: 17.28 | N32: 10.28 | O32: 6.28 | P32: 71.28 | Q32: 11.28 | S32: =RC[-16]+8 -> 27.28 | T32: =(C[-1]*1.22) - 19.14 -> 14.141599999999997 | U32: =(C[-2]*0.81) +27.23 -> 49.326800000000006 | V32: =(C[-3]*2.04) + 18.09 -> 73.741200000000006 | W32: =(C[-4]* 6.14)  - 80.71 -> 86.789200000000008 | X32: =(C[-5]*4.09)  - 41.81 -> 69.765199999999993 | Y32: =(C[-6]*2.04)- 16.9 -> 38.751200000000004 | Z32: =(C[-7]*6.14)  - 100.71 -> 66.789200000000008 | AA32: =(C[-8]*2.04) + 10.09 -> 65.741200000000006 | AB32: =(C[-9]*0.81) + 79.23 -> 101.32680000000001 | AC32: =(C[-10]*2.04) - 44.9 -> 10.751200000000004 | AD32: =(C[-11]*2.04) - 39.9 -> 15.751200000000004 | AE32: =(C[-12]*0.81) - 16.76 -> 5.3368000000000002 | AF32: =(C[-13]*0.81) - 20.76 -> 1.3368000000000002 | AG32: =(C[-14]*4.09) - 43.81 -> 67.765199999999993 | AH32: =(C[-15]*2.04) - 49.9 -> 5.7512000000000043
A33: 34 | B33: 2023-05-04 14:41:12 | C33: 19.28 | D33: 54.28 | E33: 76.28 | F33: 91.28 | G33: 71.28 | H33: 43.28 | I33: 66.28 | J33: 71.28 | K33: 105.28 | L33: 11.28 | M33: 17.28 | N33: 10.28 | O33: 6.28 | P33: 71.28 | Q33: 11.28 | S33: =RC[-16]+8 -> 27.28 | T33: =(C[-1]*1.22) - 19.14 -> 14.141599999999997 | U33: =(C[-2]*0.81) +27.23 -> 49.326800000000006 | V33: =(C[-3]*2.04) + 18.09 -> 73.741200000000006 | W33: =(C[-4]* 6.14)  - 80.71 -> 86.789200000000008 | X33: =(C[-5]*4.09)  - 41.81 -> 69.765199999999993 | Y33: =(C[-6]*2.04)- 16.9 -> 38.751200000000004 | Z33: =(C[-7]*6.14)  - 100.71 -> 66.789200000000008 | AA33: =(C[-8]*2.04) + 10.09 -> 65.741200000000006 | AB33: =(C[-9]*0.81) + 79.23 -> 101.32680000000001 | AC33: =(C[-10]*2.04) - 44.9 -> 10.751200000000004 | AD33: =(C[-11]*2.04) - 39.9 -> 15.751200000000004 | AE33: =(C[-12]*0.81) - 16.76 -> 5.3368000000000002 | AF33: =(C[-13]*0.81) - 20.76 -> 1.3368000000000002 | AG33: =(C[-14]*4.09) - 43.81 -> 67.765199999999993 | AH33: =(C[-15]*2.04) - 49.9 -> 5.7512000000000043
A34: 38 | B34: 2023-05-04 14:41:20 | C34: 19.28 | D34: 54.28 | E34: 76.28 | F34: 91.28 | G34: 71.28 | H34: 43.28 | I34: 66.28 | J34: 71.28 | K34: 105.28 | L34: 11.28 | M34: 17.28 | N34: 10.28 | O34: 6.28 | P34: 71.28 | Q34: 11.28 | S34: =RC[-16]+8 -> 27.28 | T34: =(C[-1]*1.22) - 19.14 -> 14.141599999999997 | U34: =(C[-2]*0.81) +27.23 -> 49.326800000000006 | V34: =(C[-3]*2.04) + 18.09 -> 73.741200000000006 | W34: =(C[-4]* 6.14)  - 80.71 -> 86.789200000000008 | X34: =(C[-5]*4.09)  - 41.81 -> 69.765199999999993 | Y34: =(C[-6]*2.04)- 16.9 -> 38.751200000000004 | Z34: =(C[-7]*6.14)  - 100.71 -> 66.789200000000008 | AA34: =(C[-8]*2.04) + 10.09 -> 65.741200000000006 | AB34: =(C[-9]*0.81) + 79.23 -> 101.32680000000001 | AC34: =(C[-10]*2.04) - 44.9 -> 10.751200000000004 | AD34: =(C[-11]*2.04) - 39.9 -> 15.751200000000004 | AE34: =(C[-12]*0.81) - 16.76 -> 5.3368000000000002 | AF34: =(C[-13]*0.81) - 20.76 -> 1.3368000000000002 | AG34: =(C[-14]*4.09) - 43.81 -> 67.765199999999993 | AH34: =(C[-15]*2.04) - 49.9 -> 5.7512000000000043
A35: 39 | B35: 2023-05-04 14:41:22 | C35: 19.28 | D35: 54.28 | E35: 76.28 | F35: 91.28 | G35: 71.28 | H35: 43.28 | I35: 66.28 | J35: 71.28 | K35: 105.28 | L35: 11.28 | M35: 17.28 | N35: 10.28 | O35: 6.28 | P35: 71.28 | Q35: 11.28 | S35: =RC[-16]+8 -> 27.28 | T35: =(C[-1]*1.22) - 19.14 -> 14.141599999999997 | U35: =(C[-2]*0.81) +27.23 -> 49.326800000000006 | V35: =(C[-3]*2.04) + 18.09 -> 73.741200000000006 | W35: =(C[-4]* 6.14)  - 80.71 -> 86.789200000000008 | X35: =(C[-5]*4.09)  - 41.81 -> 69.765199999999993 | Y35: =(C[-6]*2.04)- 16.9 -> 38.751200000000004 | Z35: =(C[-7]*6.14)  - 100.71 -> 66.789200000000008 | AA35: =(C[-8]*2.04) + 10.09 -> 65.741200000000006 | AB35: =(C[-9]*0.81) + 79.23 -> 101.32680000000001 | AC35: =(C[-10]*2.04) - 44.9 -> 10.751200000000004 | AD35: =(C[-11]*2.04) - 39.9 -> 15.751200000000004 | AE35: =(C[-12]*0.81) - 16.76 -> 5.3368000000000002 | AF35: =(C[-13]*0.81) - 20.76 -> 1.3368000000000002 | AG35: =(C[-14]*4.09) - 43.81 -> 67.765199999999993 | AH35: =(C[-15]*2.04) - 49.9 -> 5.7512000000000043
A36: 41 | B36: 2023-05-04 14:41:26 | C36: 19.28 | D36: 54.28 | E36: 76.28 | F36: 91.28 | G36: 71.28 | H36: 43.28 | I36: 66.28 | J36: 71.28 | K36: 105.28 | L36: 11.28 | M36: 17.28 | N36: 10.28 | O36: 6.28 | P36: 71.28 | Q36: 11.28 | S36: =RC[-16]+8 -> 27.28 | T36: =(C[-1]*1.22) - 19.14 -> 14.141599999999997 | U36: =(C[-2]*0.81) +27.23 -> 49.326800000000006 | V36: =(C[-3]*2.04) + 18.09 -> 73.741200000000006 | W36: =(C[-4]* 6.14)  - 80.71 -> 86.789200000000008 | X36: =(C[-5]*4.09)  - 41.81 -> 69.765199999999993 | Y36: =(C[-6]*2.04)- 16.9 -> 38.751200000000004 | Z36: =(C[-7]*6.14)  - 100.71 -> 66.789200000000008 | AA36: =(C[-8]*2.04) + 10.09 -> 65.741200000000006 | AB36: =(C[-9]*0.81) + 79.23 -> 101.32680000000001 | AC36: =(C[-10]*2.04) - 44.9 -> 10.751200000000004 | AD36: =(C[-11]*2.04) - 39.9 -> 15.751200000000004 | AE36: =(C[-12]*0.81) - 16.76 -> 5.3368000000000002 | AF36: =(C[-13]*0.81) - 20.76 -> 1.3368000000000002 | AG36: =(C[-14]*4.09) - 43.81 -> 67.765199999999993 | AH36: =(C[-15]*2.04) - 49.9 -> 5.7512000000000043
A37: 3 | B37: 2023-05-04 14:38:54 | C37: 18.79 | D37: 53.79 | E37: 75.790000000000006 | F37: 90.79 | G37: 70.790000000000006 | H37: 42.79 | I37: 65.790000000000006 | J37: 70.790000000000006 | K37: 104.79 | L37: 10.79 | M37: 16.79 | N37: 9.7899999999999991 | O37: 5.79 | P37: 70.790000000000006 | Q37: 10.79 | S37: =RC[-16]+8 -> 26.79 | T37: =(C[-1]*1.22) - 19.14 -> 13.543799999999997 | U37: =(C[-2]*0.81) +27.23 -> 48.929900000000004 | V37: =(C[-3]*2.04) + 18.09 -> 72.741600000000005 | W37: =(C[-4]* 6.14)  - 80.71 -> 83.780599999999978 | X37: =(C[-5]*4.09)  - 41.81 -> 67.761099999999985 | Y37: =(C[-6]*2.04)- 16.9 -> 37.751600000000003 | Z37: =(C[-7]*6.14)  - 100.71 -> 63.780599999999978 | AA37: =(C[-8]*2.04) + 10.09 -> 64.741600000000005 | AB37: =(C[-9]*0.81) + 79.23 -> 100.9299 | AC37: =(C[-10]*2.04) - 44.9 -> 9.7516000000000034 | AD37: =(C[-11]*2.04) - 39.9 -> 14.751600000000003 | AE37: =(C[-12]*0.81) - 16.76 -> 4.939899999999998 | AF37: =(C[-13]*0.81) - 20.76 -> 0.93989999999999796 | AG37: =(C[-14]*4.09) - 43.81 -> 65.761099999999985 | AH37: =(C[-15]*2.04) - 49.9 -> 4.7516000000000034
A38: 7 | B38: 2023-05-04 14:39:02 | C38: 18.79 | D38: 53.79 | E38: 75.790000000000006 | F38: 90.79 | G38: 70.790000000000006 | H38: 42.79 | I38: 65.790000000000006 | J38: 70.790000000000006 | K38: 104.79 | L38: 10.79 | M38: 16.79 | N38: 9.7899999999999991 | O38: 5.79 | P38: 70.790000000000006 | Q38: 10.79 | S38: =RC[-16]+8 -> 26.79 | T38: =(C[-1]*1.22) - 19.14 -> 13.543799999999997 | U38: =(C[-2]*0.81) +27.23 -> 48.929900000000004 | V38: =(C[-3]*2.04) + 18.09 -> 72.741600000000005 | W38: =(C[-4]* 6.14)  - 80.71 -> 83.780599999999978 | X38: =(C[-5]*4.09)  - 41.81 -> 67.761099999999985 | Y38: =(C[-6]*2.04)- 16.9 -> 37.751600000000003 | Z38: =(C[-7]*6.14)  - 100.71 -> 63.780599999999978 | AA38: =(C[-8]*2.04) + 10.09 -> 64.741600000000005 | AB38: =(C[-9]*0.81) + 79.23 -> 100.9299 | AC38: =(C[-10]*2.04) - 44.9 -> 9.7516000000000034 | AD38: =(C[-11]*2.04) - 39.9 -> 14.751600000000003 | AE38: =(C[-12]*0.81) - 16.76 -> 4.939899999999998 | AF38: =(C[-13]*0.81) - 20.76 -> 0.93989999999999796 | AG38: =(C[-14]*4.09) - 43.81 -> 65.761099999999985 | AH38: =(C[-15]*2.04) - 49.9 -> 4.7516000000000034
A39: 10 | B39: 2023-05-04 14:39:08 | C39: 18.79 | D39: 53.79 | E39: 75.790000000000006 | F39: 90.79 | G39: 70.790000000000006 | H39: 42.79 | I39: 65.790000000000006 | J39: 70.790000000000006 | K39: 104.79 | L39: 10.79 | M39: 16.79 | N39: 9.7899999999999991 | O39: 5.79 | P39: 70.790000000000006 | Q39: 10.79 | S39: =RC[-16]+8 -> 26.79 | T39: =(C[-1]*1.22) - 19.14 -> 13.543799999999997 | U39: =(C[-2]*0.81) +27.23 -> 48.929900000000004 | V39: =(C[-3]*2.04) + 18.09 -> 72.741600000000005 | W39: =(C[-4]* 6.14)  - 80.71 -> 83.780599999999978 | X39: =(C[-5]*4.09)  - 41.81 -> 67.761099999999985 | Y39: =(C[-6]*2.04)- 16.9 -> 37.751600000000003 | Z39: =(C[-7]*6.14)  - 100.71 -> 63.780599999999978 | AA39: =(C[-8]*2.04) + 10.09 -> 64.741600000000005 | AB39: =(C[-9]*0.81) + 79.23 -> 100.9299 | AC39: =(C[-10]*2.04) - 44.9 -> 9.7516000000000034 | AD39: =(C[-11]*2.04) - 39.9 -> 14.751600000000003 | AE39: =(C[-12]*0.81) - 16.76 -> 4.939899999999998 | AF39: =(C[-13]*0.81) - 20.76 -> 0.93989999999999796 | AG39: =(C[-14]*4.09) - 43.81 -> 65.761099999999985 | AH39: =(C[-15]*2.04) - 49.9 -> 4.7516000000000034
A40: 21 | B40: 2023-05-04 14:39:30 | C40: 18.79 | D40: 53.79 | E40: 75.790000000000006 | F40: 90.79 | G40: 70.790000000000006 | H40: 42.79 | I40: 65.790000000000006 | J40: 70.790000000000006 | K40: 104.79 | L40: 10.79 | M40: 16.79 | N40: 9.7899999999999991 | O40: 5.79 | P40: 70.790000000000006 | Q40: 10.79 | S40: =RC[-16]+8 -> 26.79 | T40: =(C[-1]*1.22) - 19.14 -> 13.543799999999997 | U40: =(C[-2]*0.81) +27.23 -> 48.929900000000004 | V40: =(C[-3]*2.04) + 18.09 -> 72.741600000000005 | W40: =(C[-4]* 6.14)  - 80.71 -> 83.780599999999978 | X40: =(C[-5]*4.09)  - 41.81 -> 67.761099999999985 | Y40: =(C[-6]*2.04)- 16.9 -> 37.751600000000003 | Z40: =(C[-7]*6.14)  - 100.71 -> 63.780599999999978 | AA40: =(C[-8]*2.04) + 10.09 -> 64.741600000000005 | AB40: =(C[-9]*0.81) + 79.23 -> 100.9299 | AC40: =(C[-10]*2.04) - 44.9 -> 9.7516000000000034 | AD40: =(C[-11]*2.04) - 39.9 -> 14.751600000000003 | AE40: =(C[-12]*0.81) - 16.76 -> 4.939899999999998 | AF40: =(C[-13]*0.81) - 20.76 -> 0.93989999999999796 | AG40: =(C[-14]*4.09) - 43.81 -> 65.761099999999985 | AH40: =(C[-15]*2.04) - 49.9 -> 4.7516000000000034
A41: 24 | B41: 2023-05-04 14:39:36 | C41: 18.79 | D41: 53.79 | E41: 75.790000000000006 | F41: 90.79 | G41: 70.790000000000006 | H41: 42.79 | I41: 65.790000000000006 | J41: 70.790000000000006 | K41: 104.79 | L41: 10.79 | M41: 16.79 | N41: 9.7899999999999991 | O41: 5.79 | P41: 70.790000000000006 | Q41: 10.79 | S41: =RC[-16]+8 -> 26.79 | T41: =(C[-1]*1.22) - 19.14 -> 13.543799999999997 | U41: =(C[-2]*0.81) +27.23 -> 48.929900000000004 | V41: =(C[-3]*2.04) + 18.09 -> 72.741600000000005 | W41: =(C[-4]* 6.14)  - 80.71 -> 83.780599999999978 | X41: =(C[-5]*4.09)  - 41.81 -> 67.761099999999985 | Y41: =(C[-6]*2.04)- 16.9 -> 37.751600000000003 | Z41: =(C[-7]*6.14)  - 100.71 -> 63.780599999999978 | AA41: =(C[-8]*2.04) + 10.09 -> 64.741600000000005 | AB41: =(C[-9]*0.81) + 79.23 -> 100.9299 | AC41: =(C[-10]*2.04) - 44.9 -> 9.7516000000000034 | AD41: =(C[-11]*2.04) - 39.9 -> 14.751600000000003 | AE41: =(C[-12]*0.81) - 16.76 -> 4.939899999999998 | AF41: =(C[-13]*0.81) - 20.76 -> 0.93989999999999796 | AG41: =(C[-14]*4.09) - 43.81 -> 65.761099999999985 | AH41: =(C[-15]*2.04) - 49.9 -> 4.7516000000000034
A42: 28 | B42: 2023-05-04 14:39:44 | C42: 18.79 | D42: 53.79 | E42: 75.790000000000006 | F42: 90.79 | G42: 70.790000000000006 | H42: 42.79 | I42: 65.790000000000006 | J42: 70.790000000000006 | K42: 104.79 | L42: 10.79 | M42: 16.79 | N42: 9.7899999999999991 | O42: 5.79 | P42: 70.790000000000006 | Q42: 10.79 | S42: =RC[-16]+8 -> 26.79 | T42: =(C[-1]*1.22) - 19.14 -> 13.543799999999997 | U42: =(C[-2]*0.81) +27.23 -> 48.929900000000004 | V42: =(C[-3]*2.04) + 18.09 -> 72.741600000000005 | W42: =(C[-4]* 6.14)  - 80.71 -> 83.780599999999978 | X42: =(C[-5]*4.09)  - 41.81 -> 67.761099999999985 | Y42: =(C[-6]*2.04)- 16.9 -> 37.751600000000003 | Z42: =(C[-7]*6.14)  - 100.71 -> 63.780599999999978 | AA42: =(C[-8]*2.04) + 10.09 -> 64.741600000000005 | AB42: =(C[-9]*0.81) + 79.23 -> 100.9299 | AC42: =(C[-10]*2.04) - 44.9 -> 9.7516000000000034 | AD42: =(C[-11]*2.04) - 39.9 -> 14.751600000000003 | AE42: =(C[-12]*0.81) - 16.76 -> 4.939899999999998 | AF42: =(C[-13]*0.81) - 20.76 -> 0.93989999999999796 | AG42: =(C[-14]*4.09) - 43.81 -> 65.761099999999985 | AH42: =(C[-15]*2.04) - 49.9 -> 4.7516000000000034
A43: 68 | B43: 2023-05-04 14:47:53 | C43: 18.79 | D43: 53.79 | E43: 75.790000000000006 | F43: 90.79 | G43: 70.790000000000006 | H43: 42.79 | I43: 65.790000000000006 | J43: 70.790000000000006 | K43: 104.79 | L43: 10.79 | M43: 16.79 | N43: 9.7899999999999991 | O43: 5.79 | P43: 70.790000000000006 | Q43: 10.79 | S43: =RC[-16]+8 -> 26.79 | T43: =(C[-1]*1.22) - 19.14 -> 13.543799999999997 | U43: =(C[-2]*0.81) +27.23 -> 48.929900000000004 | V43: =(C[-3]*2.04) + 18.09 -> 72.741600000000005 | W43: =(C[-4]* 6.14)  - 80.71 -> 83.780599999999978 | X43: =(C[-5]*4.09)  - 41.81 -> 67.761099999999985 | Y43: =(C[-6]*2.04)- 16.9 -> 37.751600000000003 | Z43: =(C[-7]*6.14)  - 100.71 -> 63.780599999999978 | AA43: =(C[-8]*2.04) + 10.09 -> 64.741600000000005 | AB43: =(C[-9]*0.81) + 79.23 -> 100.9299 | AC43: =(C[-10]*2.04) - 44.9 -> 9.7516000000000034 | AD43: =(C[-11]*2.04) - 39.9 -> 14.751600000000003 | AE43: =(C[-12]*0.81) - 16.76 -> 4.939899999999998 | AF43: =(C[-13]*0.81) - 20.76 -> 0.93989999999999796 | AG43: =(C[-14]*4.09) - 43.81 -> 65.761099999999985 | AH43: =(C[-15]*2.04) - 49.9 -> 4.7516000000000034
A44: 44 | B44: 2023-05-04 14:43:06 | C44: 18.3 | D44: 53.3 | E44: 75.3 | F44: 90.3 | G44: 70.3 | H44: 42.3 | I44: 65.3 | J44: 70.3 | K44: 104.3 | L44: 10.3 | M44: 16.3 | N44: 9.3000000000000007 | O44: 5.3 | P44: 70.3 | Q44: 10.3 | S44: =RC[-16]+8 -> 26.3 | T44: =(C[-1]*1.22) - 19.14 -> 12.945999999999998 | U44: =(C[-2]*0.81) +27.23 -> 48.533000000000001 | V44: =(C[-3]*2.04) + 18.09 -> 71.742000000000004 | W44: =(C[-4]* 6.14)  - 80.71 -> 80.772000000000006 | X44: =(C[-5]*4.09)  - 41.81 -> 65.756999999999991 | Y44: =(C[-6]*2.04)- 16.9 -> 36.752000000000002 | Z44: =(C[-7]*6.14)  - 100.71 -> 60.772000000000006 | AA44: =(C[-8]*2.04) + 10.09 -> 63.742000000000004 | AB44: =(C[-9]*0.81) + 79.23 -> 100.533 | AC44: =(C[-10]*2.04) - 44.9 -> 8.7520000000000024 | AD44: =(C[-11]*2.04) - 39.9 -> 13.752000000000002 | AE44: =(C[-12]*0.81) - 16.76 -> 4.5429999999999993 | AF44: =(C[-13]*0.81) - 20.76 -> 0.54299999999999926 | AG44: =(C[-14]*4.09) - 43.81 -> 63.756999999999991 | AH44: =(C[-15]*2.04) - 49.9 -> 3.7520000000000024
A45: 55 | B45: 2023-05-04 14:47:03 | C45: 18.3 | D45: 53.3 | E45: 75.3 | F45: 90.3 | G45: 70.3 | H45: 42.3 | I45: 65.3 | J45: 70.3 | K45: 104.3 | L45: 10.3 | M45: 16.3 | N45: 9.3000000000000007 | O45: 5.3 | P45: 70.3 | Q45: 10.3 | S45: =RC[-16]+8 -> 26.3 | T45: =(C[-1]*1.22) - 19.14 -> 12.945999999999998 | U45: =(C[-2]*0.81) +27.23 -> 48.533000000000001 | V45: =(C[-3]*2.04) + 18.09 -> 71.742000000000004 | W45: =(C[-4]* 6.14)  - 80.71 -> 80.772000000000006 | X45: =(C[-5]*4.09)  - 41.81 -> 65.756999999999991 | Y45: =(C[-6]*2.04)- 16.9 -> 36.752000000000002 | Z45: =(C[-7]*6.14)  - 100.71 -> 60.772000000000006 | AA45: =(C[-8]*2.04) + 10.09 -> 63.742000000000004 | AB45: =(C[-9]*0.81) + 79.23 -> 100.533 | AC45: =(C[-10]*2.04) - 44.9 -> 8.7520000000000024 | AD45: =(C[-11]*2.04) - 39.9 -> 13.752000000000002 | AE45: =(C[-12]*0.81) - 16.76 -> 4.5429999999999993 | AF45: =(C[-13]*0.81) - 20.76 -> 0.54299999999999926 | AG45: =(C[-14]*4.09) - 43.81 -> 63.756999999999991 | AH45: =(C[-15]*2.04) - 49.9 -> 3.7520000000000024
A46: 58 | B46: 2023-05-04 14:47:09 | C46: 18.3 | D46: 53.3 | E46: 75.3 | F46: 90.3 | G46: 70.3 | H46: 42.3 | I46: 65.3 | J46: 70.3 | K46: 104.3 | L46: 10.3 | M46: 16.3 | N46: 9.3000000000000007 | O46: 5.3 | P46: 70.3 | Q46: 10.3 | S46: =RC[-16]+8 -> 26.3 | T46: =(C[-1]*1.22) - 19.14 -> 12.945999999999998 | U46: =(C[-2]*0.81) +27.23 -> 48.533000000000001 | V46: =(C[-3]*2.04) + 18.09 -> 71.742000000000004 | W46: =(C[-4]* 6.14)  - 80.71 -> 80.772000000000006 | X46: =(C[-5]*4.09)  - 41.81 -> 65.756999999999991 | Y46: =(C[-6]*2.04)- 16.9 -> 36.752000000000002 | Z46: =(C[-7]*6.14)  - 100.71 -> 60.772000000000006 | AA46: =(C[-8]*2.04) + 10.09 -> 63.742000000000004 | AB46: =(C[-9]*0.81) + 79.23 -> 100.533 | AC46: =(C[-10]*2.04) - 44.9 -> 8.7520000000000024 | AD46: =(C[-11]*2.04) - 39.9 -> 13.752000000000002 | AE46: =(C[-12]*0.81) - 16.76 -> 4.5429999999999993 | AF46: =(C[-13]*0.81) - 20.76 -> 0.54299999999999926 | AG46: =(C[-14]*4.09) - 43.81 -> 63.756999999999991 | AH46: =(C[-15]*2.04) - 49.9 -> 3.7520000000000024
A47: 61 | B47: 2023-05-04 14:47:15 | C47: 18.3 | D47: 53.3 | E47: 75.3 | F47: 90.3 | G47: 70.3 | H47: 42.3 | I47: 65.3 | J47: 70.3 | K47: 104.3 | L47: 10.3 | M47: 16.3 | N47: 9.3000000000000007 | O47: 5.3 | P47: 70.3 | Q47: 10.3 | S47: =RC[-16]+8 -> 26.3 | T47: =(C[-1]*1.22) - 19.14 -> 12.945999999999998 | U47: =(C[-2]*0.81) +27.23 -> 48.533000000000001 | V47: =(C[-3]*2.04) + 18.09 -> 71.742000000000004 | W47: =(C[-4]* 6.14)  - 80.71 -> 80.772000000000006 | X47: =(C[-5]*4.09)  - 41.81 -> 65.756999999999991 | Y47: =(C[-6]*2.04)- 16.9 -> 36.752000000000002 | Z47: =(C[-7]*6.14)  - 100.71 -> 60.772000000000006 | AA47: =(C[-8]*2.04) + 10.09 -> 63.742000000000004 | AB47: =(C[-9]*0.81) + 79.23 -> 100.533 | AC47: =(C[-10]*2.04) - 44.9 -> 8.7520000000000024 | AD47: =(C[-11]*2.04) - 39.9 -> 13.752000000000002 | AE47: =(C[-12]*0.81) - 16.76 -> 4.5429999999999993 | AF47: =(C[-13]*0.81) - 20.76 -> 0.54299999999999926 | AG47: =(C[-14]*4.09) - 43.81 -> 63.756999999999991 | AH47: =(C[-15]*2.04) - 49.9 -> 3.7520000000000024
A48: 63 | B48: 2023-05-04 14:47:19 | C48: 18.3 | D48: 53.3 | E48: 75.3 | F48: 90.3 | G48: 70.3 | H48: 42.3 | I48: 65.3 | J48: 70.3 | K48: 104.3 | L48: 10.3 | M48: 16.3 | N48: 9.3000000000000007 | O48: 5.3 | P48: 70.3 | Q48: 10.3 | S48: =RC[-16]+8 -> 26.3 | T48: =(C[-1]*1.22) - 19.14 -> 12.945999999999998 | U48: =(C[-2]*0.81) +27.23 -> 48.533000000000001 | V48: =(C[-3]*2.04) + 18.09 -> 71.742000000000004 | W48: =(C[-4]* 6.14)  - 80.71 -> 80.772000000000006 | X48: =(C[-5]*4.09)  - 41.81 -> 65.756999999999991 | Y48: =(C[-6]*2.04)- 16.9 -> 36.752000000000002 | Z48: =(C[-7]*6.14)  - 100.71 -> 60.772000000000006 | AA48: =(C[-8]*2.04) + 10.09 -> 63.742000000000004 | AB48: =(C[-9]*0.81) + 79.23 -> 100.533 | AC48: =(C[-10]*2.04) - 44.9 -> 8.7520000000000024 | AD48: =(C[-11]*2.04) - 39.9 -> 13.752000000000002 | AE48: =(C[-12]*0.81) - 16.76 -> 4.5429999999999993 | AF48: =(C[-13]*0.81) - 20.76 -> 0.54299999999999926 | AG48: =(C[-14]*4.09) - 43.81 -> 63.756999999999991 | AH48: =(C[-15]*2.04) - 49.9 -> 3.7520000000000024
A49: 67 | B49: 2023-05-04 14:47:27 | C49: 18.3 | D49: 53.3 | E49: 75.3 | F49: 90.3 | G49: 70.3 | H49: 42.3 | I49: 65.3 | J49: 70.3 | K49: 104.3 | L49: 10.3 | M49: 16.3 | N49: 9.3000000000000007 | O49: 5.3 | P49: 70.3 | Q49: 10.3 | S49: =RC[-16]+8 -> 26.3 | T49: =(C[-1]*1.22) - 19.14 -> 12.945999999999998 | U49: =(C[-2]*0.81) +27.23 -> 48.533000000000001 | V49: =(C[-3]*2.04) + 18.09 -> 71.742000000000004 | W49: =(C[-4]* 6.14)  - 80.71 -> 80.772000000000006 | X49: =(C[-5]*4.09)  - 41.81 -> 65.756999999999991 | Y49: =(C[-6]*2.04)- 16.9 -> 36.752000000000002 | Z49: =(C[-7]*6.14)  - 100.71 -> 60.772000000000006 | AA49: =(C[-8]*2.04) + 10.09 -> 63.742000000000004 | AB49: =(C[-9]*0.81) + 79.23 -> 100.533 | AC49: =(C[-10]*2.04) - 44.9 -> 8.7520000000000024 | AD49: =(C[-11]*2.04) - 39.9 -> 13.752000000000002 | AE49: =(C[-12]*0.81) - 16.76 -> 4.5429999999999993 | AF49: =(C[-13]*0.81) - 20.76 -> 0.54299999999999926 | AG49: =(C[-14]*4.09) - 43.81 -> 63.756999999999991 | AH49: =(C[-15]*2.04) - 49.9 -> 3.7520000000000024
A50: 69 | B50: 2023-05-04 14:47:55 | C50: 18.3 | D50: 53.3 | E50: 75.3 | F50: 90.3 | G50: 70.3 | H50: 42.3 | I50: 65.3 | J50: 70.3 | K50: 104.3 | L50: 10.3 | M50: 16.3 | N50: 9.3000000000000007 | O50: 5.3 | P50: 70.3 | Q50: 10.3 | S50: =RC[-16]+8 -> 26.3 | T50: =(C[-1]*1.22) - 19.14 -> 12.945999999999998 | U50: =(C[-2]*0.81) +27.23 -> 48.533000000000001 | V50: =(C[-3]*2.04) + 18.09 -> 71.742000000000004 | W50: =(C[-4]* 6.14)  - 80.71 -> 80.772000000000006 | X50: =(C[-5]*4.09)  - 41.81 -> 65.756999999999991 | Y50: =(C[-6]*2.04)- 16.9 -> 36.752000000000002 | Z50: =(C[-7]*6.14)  - 100.71 -> 60.772000000000006 | AA50: =(C[-8]*2.04) + 10.09 -> 63.742000000000004 | AB50: =(C[-9]*0.81) + 79.23 -> 100.533 | AC50: =(C[-10]*2.04) - 44.9 -> 8.7520000000000024 | AD50: =(C[-11]*2.04) - 39.9 -> 13.752000000000002 | AE50: =(C[-12]*0.81) - 16.76 -> 4.5429999999999993 | AF50: =(C[-13]*0.81) - 20.76 -> 0.54299999999999926 | AG50: =(C[-14]*4.09) - 43.81 -> 63.756999999999991 | AH50: =(C[-15]*2.04) - 49.9 -> 3.7520000000000024
A51: 71 | B51: 2023-05-04 14:47:59 | C51: 18.3 | D51: 53.3 | E51: 75.3 | F51: 90.3 | G51: 70.3 | H51: 42.3 | I51: 65.3 | J51: 70.3 | K51: 104.3 | L51: 10.3 | M51: 16.3 | N51: 9.3000000000000007 | O51: 5.3 | P51: 70.3 | Q51: 10.3 | S51: =RC[-16]+8 -> 26.3 | T51: =(C[-1]*1.22) - 19.14 -> 12.945999999999998 | U51: =(C[-2]*0.81) +27.23 -> 48.533000000000001 | V51: =(C[-3]*2.04) + 18.09 -> 71.742000000000004 | W51: =(C[-4]* 6.14)  - 80.71 -> 80.772000000000006 | X51: =(C[-5]*4.09)  - 41.81 -> 65.756999999999991 | Y51: =(C[-6]*2.04)- 16.9 -> 36.752000000000002 | Z51: =(C[-7]*6.14)  - 100.71 -> 60.772000000000006 | AA51: =(C[-8]*2.04) + 10.09 -> 63.742000000000004 | AB51: =(C[-9]*0.81) + 79.23 -> 100.533 | AC51: =(C[-10]*2.04) - 44.9 -> 8.7520000000000024 | AD51: =(C[-11]*2.04) - 39.9 -> 13.752000000000002 | AE51: =(C[-12]*0.81) - 16.76 -> 4.5429999999999993 | AF51: =(C[-13]*0.81) - 20.76 -> 0.54299999999999926 | AG51: =(C[-14]*4.09) - 43.81 -> 63.756999999999991 | AH51: =(C[-15]*2.04) - 49.9 -> 3.7520000000000024
A52: 72 | B52: 2023-05-04 14:48:01 | C52: 18.3 | D52: 53.3 | E52: 75.3 | F52: 90.3 | G52: 70.3 | H52: 42.3 | I52: 65.3 | J52: 70.3 | K52: 104.3 | L52: 10.3 | M52: 16.3 | N52: 9.3000000000000007 | O52: 5.3 | P52: 70.3 | Q52: 10.3 | S52: =RC[-16]+8 -> 26.3 | T52: =(C[-1]*1.22) - 19.14 -> 12.945999999999998 | U52: =(C[-2]*0.81) +27.23 -> 48.533000000000001 | V52: =(C[-3]*2.04) + 18.09 -> 71.742000000000004 | W52: =(C[-4]* 6.14)  - 80.71 -> 80.772000000000006 | X52: =(C[-5]*4.09)  - 41.81 -> 65.756999999999991 | Y52: =(C[-6]*2.04)- 16.9 -> 36.752000000000002 | Z52: =(C[-7]*6.14)  - 100.71 -> 60.772000000000006 | AA52: =(C[-8]*2.04) + 10.09 -> 63.742000000000004 | AB52: =(C[-9]*0.81) + 79.23 -> 100.533 | AC52: =(C[-10]*2.04) - 44.9 -> 8.7520000000000024 | AD52: =(C[-11]*2.04) - 39.9 -> 13.752000000000002 | AE52: =(C[-12]*0.81) - 16.76 -> 4.5429999999999993 | AF52: =(C[-13]*0.81) - 20.76 -> 0.54299999999999926 | AG52: =(C[-14]*4.09) - 43.81 -> 63.756999999999991 | AH52: =(C[-15]*2.04) - 49.9 -> 3.7520000000000024
A53: 74 | B53: 2023-05-04 14:48:05 | C53: 18.3 | D53: 53.3 | E53: 75.3 | F53: 90.3 | G53: 70.3 | H53: 42.3 | I53: 65.3 | J53: 70.3 | K53: 104.3 | L53: 10.3 | M53: 16.3 | N53: 9.3000000000000007 | O53: 5.3 | P53: 70.3 | Q53: 10.3 | S53: =RC[-16]+8 -> 26.3 | T53: =(C[-1]*1.22) - 19.14 -> 12.945999999999998 | U53: =(C[-2]*0.81) +27.23 -> 48.533000000000001 | V53: =(C[-3]*2.04) + 18.09 -> 71.742000000000004 | W53: =(C[-4]* 6.14)  - 80.71 -> 80.772000000000006 | X53: =(C[-5]*4.09)  - 41.81 -> 65.756999999999991 | Y53: =(C[-6]*2.04)- 16.9 -> 36.752000000000002 | Z53: =(C[-7]*6.14)  - 100.71 -> 60.772000000000006 | AA53: =(C[-8]*2.04) + 10.09 -> 63.742000000000004 | AB53: =(C[-9]*0.81) + 79.23 -> 100.533 | AC53: =(C[-10]*2.04) - 44.9 -> 8.7520000000000024 | AD53: =(C[-11]*2.04) - 39.9 -> 13.752000000000002 | AE53: =(C[-12]*0.81) - 16.76 -> 4.5429999999999993 | AF53: =(C[-13]*0.81) - 20.76 -> 0.54299999999999926 | AG53: =(C[-14]*4.09) - 43.81 -> 63.756999999999991 | AH53: =(C[-15]*2.04) - 49.9 -> 3.7520000000000024
A54: 75 | B54: 2023-05-04 14:48:07 | C54: 18.3 | D54: 53.3 | E54: 75.3 | F54: 90.3 | G54: 70.3 | H54: 42.3 | I54: 65.3 | J54: 70.3 | K54: 104.3 | L54: 10.3 | M54: 16.3 | N54: 9.3000000000000007 | O54: 5.3 | P54: 70.3 | Q54: 10.3 | S54: =RC[-16]+8 -> 26.3 | T54: =(C[-1]*1.22) - 19.14 -> 12.945999999999998 | U54: =(C[-2]*0.81) +27.23 -> 48.533000000000001 | V54: =(C[-3]*2.04) + 18.09 -> 71.742000000000004 | W54: =(C[-4]* 6.14)  - 80.71 -> 80.772000000000006 | X54: =(C[-5]*4.09)  - 41.81 -> 65.756999999999991 | Y54: =(C[-6]*2.04)- 16.9 -> 36.752000000000002 | Z54: =(C[-7]*6.14)  - 100.71 -> 60.772000000000006 | AA54: =(C[-8]*2.04) + 10.09 -> 63.742000000000004 | AB54: =(C[-9]*0.81) + 79.23 -> 100.533 | AC54: =(C[-10]*2.04) - 44.9 -> 8.7520000000000024 | AD54: =(C[-11]*2.04) - 39.9 -> 13.752000000000002 | AE54: =(C[-12]*0.81) - 16.76 -> 4.5429999999999993 | AF54: =(C[-13]*0.81) - 20.76 -> 0.54299999999999926 | AG54: =(C[-14]*4.09) - 43.81 -> 63.756999999999991 | AH54: =(C[-15]*2.04) - 49.9 -> 3.7520000000000024
A55: 42 | B55: 2023-05-04 14:43:02 | C55: 17.809999999999999 | D55: 52.81 | E55: 74.81 | F55: 89.81 | G55: 69.81 | H55: 41.81 | I55: 64.81 | J55: 69.81 | K55: 103.81 | L55: 9.81 | M55: 15.81 | N55: 8.81 | O55: 4.8099999999999996 | P55: 69.81 | Q55: 9.81 | S55: =RC[-16]+8 -> 25.81 | T55: =(C[-1]*1.22) - 19.14 -> 12.348199999999999 | U55: =(C[-2]*0.81) +27.23 -> 48.136099999999999 | V55: =(C[-3]*2.04) + 18.09 -> 70.742400000000004 | W55: =(C[-4]* 6.14)  - 80.71 -> 77.763400000000004 | X55: =(C[-5]*4.09)  - 41.81 -> 63.752899999999983 | Y55: =(C[-6]*2.04)- 16.9 -> 35.752400000000002 | Z55: =(C[-7]*6.14)  - 100.71 -> 57.763400000000004 | AA55: =(C[-8]*2.04) + 10.09 -> 62.742400000000004 | AB55: =(C[-9]*0.81) + 79.23 -> 100.1361 | AC55: =(C[-10]*2.04) - 44.9 -> 7.7524000000000015 | AD55: =(C[-11]*2.04) - 39.9 -> 12.752400000000002 | AE55: =(C[-12]*0.81) - 16.76 -> 4.146099999999997 | AF55: =(C[-13]*0.81) - 20.76 -> 0.14609999999999701 | AG55: =(C[-14]*4.09) - 43.81 -> 61.752899999999983 | AH55: =(C[-15]*2.04) - 49.9 -> 2.7524000000000015
A56: 45 | B56: 2023-05-04 14:43:08 | C56: 17.809999999999999 | D56: 52.81 | E56: 74.81 | F56: 89.81 | G56: 69.81 | H56: 41.81 | I56: 64.81 | J56: 69.81 | K56: 103.81 | L56: 9.81 | M56: 15.81 | N56: 8.81 | O56: 4.8099999999999996 | P56: 69.81 | Q56: 9.81 | S56: =RC[-16]+8 -> 25.81 | T56: =(C[-1]*1.22) - 19.14 -> 12.348199999999999 | U56: =(C[-2]*0.81) +27.23 -> 48.136099999999999 | V56: =(C[-3]*2.04) + 18.09 -> 70.742400000000004 | W56: =(C[-4]* 6.14)  - 80.71 -> 77.763400000000004 | X56: =(C[-5]*4.09)  - 41.81 -> 63.752899999999983 | Y56: =(C[-6]*2.04)- 16.9 -> 35.752400000000002 | Z56: =(C[-7]*6.14)  - 100.71 -> 57.763400000000004 | AA56: =(C[-8]*2.04) + 10.09 -> 62.742400000000004 | AB56: =(C[-9]*0.81) + 79.23 -> 100.1361 | AC56: =(C[-10]*2.04) - 44.9 -> 7.7524000000000015 | AD56: =(C[-11]*2.04) - 39.9 -> 12.752400000000002 | AE56: =(C[-12]*0.81) - 16.76 -> 4.146099999999997 | AF56: =(C[-13]*0.81) - 20.76 -> 0.14609999999999701 | AG56: =(C[-14]*4.09) - 43.81 -> 61.752899999999983 | AH56: =(C[-15]*2.04) - 49.9 -> 2.7524000000000015
A57: 46 | B57: 2023-05-04 14:43:10 | C57: 17.809999999999999 | D57: 52.81 | E57: 74.81 | F57: 89.81 | G57: 69.81 | H57: 41.81 | I57: 64.81 | J57: 69.81 | K57: 103.81 | L57: 9.81 | M57: 15.81 | N57: 8.81 | O57: 4.8099999999999996 | P57: 69.81 | Q57: 9.81 | S57: =RC[-16]+8 -> 25.81 | T57: =(C[-1]*1.22) - 19.14 -> 12.348199999999999 | U57: =(C[-2]*0.81) +27.23 -> 48.136099999999999 | V57: =(C[-3]*2.04) + 18.09 -> 70.742400000000004 | W57: =(C[-4]* 6.14)  - 80.71 -> 77.763400000000004 | X57: =(C[-5]*4.09)  - 41.81 -> 63.752899999999983 | Y57: =(C[-6]*2.04)- 16.9 -> 35.752400000000002 | Z57: =(C[-7]*6.14)  - 100.71 -> 57.763400000000004 | AA57: =(C[-8]*2.04) + 10.09 -> 62.742400000000004 | AB57: =(C[-9]*0.81) + 79.23 -> 100.1361 | AC57: =(C[-10]*2.04) - 44.9 -> 7.7524000000000015 | AD57: =(C[-11]*2.04) - 39.9 -> 12.752400000000002 | AE57: =(C[-12]*0.81) - 16.76 -> 4.146099999999997 | AF57: =(C[-13]*0.81) - 20.76 -> 0.14609999999999701 | AG57: =(C[-14]*4.09) - 43.81 -> 61.752899999999983 | AH57: =(C[-15]*2.04) - 49.9 -> 2.7524000000000015
A58: 47 | B58: 2023-05-04 14:43:12 | C58: 17.809999999999999 | D58: 52.81 | E58: 74.81 | F58: 89.81 | G58: 69.81 | H58: 41.81 | I58: 64.81 | J58: 69.81 | K58: 103.81 | L58: 9.81 | M58: 15.81 | N58: 8.81 | O58: 4.8099999999999996 | P58: 69.81 | Q58: 9.81 | S58: =RC[-16]+8 -> 25.81 | T58: =(C[-1]*1.22) - 19.14 -> 12.348199999999999 | U58: =(C[-2]*0.81) +27.23 -> 48.136099999999999 | V58: =(C[-3]*2.04) + 18.09 -> 70.742400000000004 | W58: =(C[-4]* 6.14)  - 80.71 -> 77.763400000000004 | X58: =(C[-5]*4.09)  - 41.81 -> 63.752899999999983 | Y58: =(C[-6]*2.04)- 16.9 -> 35.752400000000002 | Z58: =(C[-7]*6.14)  - 100.71 -> 57.763400000000004 | AA58: =(C[-8]*2.04) + 10.09 -> 62.742400000000004 | AB58: =(C[-9]*0.81) + 79.23 -> 100.1361 | AC58: =(C[-10]*2.04) - 44.9 -> 7.7524000000000015 | AD58: =(C[-11]*2.04) - 39.9 -> 12.752400000000002 | AE58: =(C[-12]*0.81) - 16.76 -> 4.146099999999997 | AF58: =(C[-13]*0.81) - 20.76 -> 0.14609999999999701 | AG58: =(C[-14]*4.09) - 43.81 -> 61.752899999999983 | AH58: =(C[-15]*2.04) - 49.9 -> 2.7524000000000015
A59: 48 | B59: 2023-05-04 14:43:14 | C59: 17.809999999999999 | D59: 52.81 | E59: 74.81 | F59: 89.81 | G59: 69.81 | H59: 41.81 | I59: 64.81 | J59: 69.81 | K59: 103.81 | L59: 9.81 | M59: 15.81 | N59: 8.81 | O59: 4.8099999999999996 | P59: 69.81 | Q59: 9.81 | S59: =RC[-16]+8 -> 25.81 | T59: =(C[-1]*1.22) - 19.14 -> 12.348199999999999 | U59: =(C[-2]*0.81) +27.23 -> 48.136099999999999 | V59: =(C[-3]*2.04) + 18.09 -> 70.742400000000004 | W59: =(C[-4]* 6.14)  - 80.71 -> 77.763400000000004 | X59: =(C[-5]*4.09)  - 41.81 -> 63.752899999999983 | Y59: =(C[-6]*2.04)- 16.9 -> 35.752400000000002 | Z59: =(C[-7]*6.14)  - 100.71 -> 57.763400000000004 | AA59: =(C[-8]*2.04) + 10.09 -> 62.742400000000004 | AB59: =(C[-9]*0.81) + 79.23 -> 100.1361 | AC59: =(C[-10]*2.04) - 44.9 -> 7.7524000000000015 | AD59: =(C[-11]*2.04) - 39.9 -> 12.752400000000002 | AE59: =(C[-12]*0.81) - 16.76 -> 4.146099999999997 | AF59: =(C[-13]*0.81) - 20.76 -> 0.14609999999999701 | AG59: =(C[-14]*4.09) - 43.81 -> 61.752899999999983 | AH59: =(C[-15]*2.04) - 49.9 -> 2.7524000000000015
A60: 49 | B60: 2023-05-04 14:43:16 | C60: 17.809999999999999 | D60: 52.81 | E60: 74.81 | F60: 89.81 | G60: 69.81 | H60: 41.81 | I60: 64.81 | J60: 69.81 | K60: 103.81 | L60: 9.81 | M60: 15.81 | N60: 8.81 | O60: 4.8099999999999996 | P60: 69.81 | Q60: 9.81 | S60: =RC[-16]+8 -> 25.81 | T60: =(C[-1]*1.22) - 19.14 -> 12.348199999999999 | U60: =(C[-2]*0.81) +27.23 -> 48.136099999999999 | V60: =(C[-3]*2.04) + 18.09 -> 70.742400000000004 | W60: =(C[-4]* 6.14)  - 80.71 -> 77.763400000000004 | X60: =(C[-5]*4.09)  - 41.81 -> 63.752899999999983 | Y60: =(C[-6]*2.04)- 16.9 -> 35.752400000000002 | Z60: =(C[-7]*6.14)  - 100.71 -> 57.763400000000004 | AA60: =(C[-8]*2.04) + 10.09 -> 62.742400000000004 | AB60: =(C[-9]*0.81) + 79.23 -> 100.1361 | AC60: =(C[-10]*2.04) - 44.9 -> 7.7524000000000015 | AD60: =(C[-11]*2.04) - 39.9 -> 12.752400000000002 | AE60: =(C[-12]*0.81) - 16.76 -> 4.146099999999997 | AF60: =(C[-13]*0.81) - 20.76 -> 0.14609999999999701 | AG60: =(C[-14]*4.09) - 43.81 -> 61.752899999999983 | AH60: =(C[-15]*2.04) - 49.9 -> 2.7524000000000015
A61: 50 | B61: 2023-05-04 14:43:18 | C61: 17.809999999999999 | D61: 52.81 | E61: 74.81 | F61: 89.81 | G61: 69.81 | H61: 41.81 | I61: 64.81 | J61: 69.81 | K61: 103.81 | L61: 9.81 | M61: 15.81 | N61: 8.81 | O61: 4.8099999999999996 | P61: 69.81 | Q61: 9.81 | S61: =RC[-16]+8 -> 25.81 | T61: =(C[-1]*1.22) - 19.14 -> 12.348199999999999 | U61: =(C[-2]*0.81) +27.23 -> 48.136099999999999 | V61: =(C[-3]*2.04) + 18.09 -> 70.742400000000004 | W61: =(C[-4]* 6.14)  - 80.71 -> 77.763400000000004 | X61: =(C[-5]*4.09)  - 41.81 -> 63.752899999999983 | Y61: =(C[-6]*2.04)- 16.9 -> 35.752400000000002 | Z61: =(C[-7]*6.14)  - 100.71 -> 57.763400000000004 | AA61: =(C[-8]*2.04) + 10.09 -> 62.742400000000004 | AB61: =(C[-9]*0.81) + 79.23 -> 100.1361 | AC61: =(C[-10]*2.04) - 44.9 -> 7.7524000000000015 | AD61: =(C[-11]*2.04) - 39.9 -> 12.752400000000002 | AE61: =(C[-12]*0.81) - 16.76 -> 4.146099999999997 | AF61: =(C[-13]*0.81) - 20.76 -> 0.14609999999999701 | AG61: =(C[-14]*4.09) - 43.81 -> 61.752899999999983 | AH61: =(C[-15]*2.04) - 49.9 -> 2.7524000000000015
A62: 51 | B62: 2023-05-04 14:43:20 | C62: 17.809999999999999 | D62: 52.81 | E62: 74.81 | F62: 89.81 | G62: 69.81 | H62: 41.81 | I62: 64.81 | J62: 69.81 | K62: 103.81 | L62: 9.81 | M62: 15.81 | N62: 8.81 | O62: 4.8099999999999996 | P62: 69.81 | Q62: 9.81 | S62: =RC[-16]+8 -> 25.81 | T62: =(C[-1]*1.22) - 19.14 -> 12.348199999999999 | U62: =(C[-2]*0.81) +27.23 -> 48.136099999999999 | V62: =(C[-3]*2.04) + 18.09 -> 70.742400000000004 | W62: =(C[-4]* 6.14)  - 80.71 -> 77.763400000000004 | X62: =(C[-5]*4.09)  - 41.81 -> 63.752899999999983 | Y62: =(C[-6]*2.04)- 16.9 -> 35.752400000000002 | Z62: =(C[-7]*6.14)  - 100.71 -> 57.763400000000004 | AA62: =(C[-8]*2.04) + 10.09 -> 62.742400000000004 | AB62: =(C[-9]*0.81) + 79.23 -> 100.1361 | AC62: =(C[-10]*2.04) - 44.9 -> 7.7524000000000015 | AD62: =(C[-11]*2.04) - 39.9 -> 12.752400000000002 | AE62: =(C[-12]*0.81) - 16.76 -> 4.146099999999997 | AF62: =(C[-13]*0.81) - 20.76 -> 0.14609999999999701 | AG62: =(C[-14]*4.09) - 43.81 -> 61.752899999999983 | AH62: =(C[-15]*2.04) - 49.9 -> 2.7524000000000015
A63: 52 | B63: 2023-05-04 14:43:22 | C63: 17.809999999999999 | D63: 52.81 | E63: 74.81 | F63: 89.81 | G63: 69.81 | H63: 41.81 | I63: 64.81 | J63: 69.81 | K63: 103.81 | L63: 9.81 | M63: 15.81 | N63: 8.81 | O63: 4.8099999999999996 | P63: 69.81 | Q63: 9.81 | S63: =RC[-16]+8 -> 25.81 | T63: =(C[-1]*1.22) - 19.14 -> 12.348199999999999 | U63: =(C[-2]*0.81) +27.23 -> 48.136099999999999 | V63: =(C[-3]*2.04) + 18.09 -> 70.742400000000004 | W63: =(C[-4]* 6.14)  - 80.71 -> 77.763400000000004 | X63: =(C[-5]*4.09)  - 41.81 -> 63.752899999999983 | Y63: =(C[-6]*2.04)- 16.9 -> 35.752400000000002 | Z63: =(C[-7]*6.14)  - 100.71 -> 57.763400000000004 | AA63: =(C[-8]*2.04) + 10.09 -> 62.742400000000004 | AB63: =(C[-9]*0.81) + 79.23 -> 100.1361 | AC63: =(C[-10]*2.04) - 44.9 -> 7.7524000000000015 | AD63: =(C[-11]*2.04) - 39.9 -> 12.752400000000002 | AE63: =(C[-12]*0.81) - 16.76 -> 4.146099999999997 | AF63: =(C[-13]*0.81) - 20.76 -> 0.14609999999999701 | AG63: =(C[-14]*4.09) - 43.81 -> 61.752899999999983 | AH63: =(C[-15]*2.04) - 49.9 -> 2.7524000000000015
A64: 53 | B64: 2023-05-04 14:43:24 | C64: 17.809999999999999 | D64: 52.81 | E64: 74.81 | F64: 89.81 | G64: 69.81 | H64: 41.81 | I64: 64.81 | J64: 69.81 | K64: 103.81 | L64: 9.81 | M64: 15.81 | N64: 8.81 | O64: 4.8099999999999996 | P64: 69.81 | Q64: 9.81 | S64: =RC[-16]+8 -> 25.81 | T64: =(C[-1]*1.22) - 19.14 -> 12.348199999999999 | U64: =(C[-2]*0.81) +27.23 -> 48.136099999999999 | V64: =(C[-3]*2.04) + 18.09 -> 70.742400000000004 | W64: =(C[-4]* 6.14)  - 80.71 -> 77.763400000000004 | X64: =(C[-5]*4.09)  - 41.81 -> 63.752899999999983 | Y64: =(C[-6]*2.04)- 16.9 -> 35.752400000000002 | Z64: =(C[-7]*6.14)  - 100.71 -> 57.763400000000004 | AA64: =(C[-8]*2.04) + 10.09 -> 62.742400000000004 | AB64: =(C[-9]*0.81) + 79.23 -> 100.1361 | AC64: =(C[-10]*2.04) - 44.9 -> 7.7524000000000015 | AD64: =(C[-11]*2.04) - 39.9 -> 12.752400000000002 | AE64: =(C[-12]*0.81) - 16.76 -> 4.146099999999997 | AF64: =(C[-13]*0.81) - 20.76 -> 0.14609999999999701 | AG64: =(C[-14]*4.09) - 43.81 -> 61.752899999999983 | AH64: =(C[-15]*2.04) - 49.9 -> 2.7524000000000015
A65: 54 | B65: 2023-05-04 14:43:26 | C65: 17.809999999999999 | D65: 52.81 | E65: 74.81 | F65: 89.81 | G65: 69.81 | H65: 41.81 | I65: 64.81 | J65: 69.81 | K65: 103.81 | L65: 9.81 | M65: 15.81 | N65: 8.81 | O65: 4.8099999999999996 | P65: 69.81 | Q65: 9.81 | S65: =RC[-16]+8 -> 25.81 | T65: =(C[-1]*1.22) - 19.14 -> 12.348199999999999 | U65: =(C[-2]*0.81) +27.23 -> 48.136099999999999 | V65: =(C[-3]*2.04) + 18.09 -> 70.742400000000004 | W65: =(C[-4]* 6.14)  - 80.71 -> 77.763400000000004 | X65: =(C[-5]*4.09)  - 41.81 -> 63.752899999999983 | Y65: =(C[-6]*2.04)- 16.9 -> 35.752400000000002 | Z65: =(C[-7]*6.14)  - 100.71 -> 57.763400000000004 | AA65: =(C[-8]*2.04) + 10.09 -> 62.742400000000004 | AB65: =(C[-9]*0.81) + 79.23 -> 100.1361 | AC65: =(C[-10]*2.04) - 44.9 -> 7.7524000000000015 | AD65: =(C[-11]*2.04) - 39.9 -> 12.752400000000002 | AE65: =(C[-12]*0.81) - 16.76 -> 4.146099999999997 | AF65: =(C[-13]*0.81) - 20.76 -> 0.14609999999999701 | AG65: =(C[-14]*4.09) - 43.81 -> 61.752899999999983 | AH65: =(C[-15]*2.04) - 49.9 -> 2.7524000000000015
A66: 56 | B66: 2023-05-04 14:47:05 | C66: 17.809999999999999 | D66: 52.81 | E66: 74.81 | F66: 89.81 | G66: 69.81 | H66: 41.81 | I66: 64.81 | J66: 69.81 | K66: 103.81 | L66: 9.81 | M66: 15.81 | N66: 8.81 | O66: 4.8099999999999996 | P66: 69.81 | Q66: 9.81 | S66: =RC[-16]+8 -> 25.81 | T66: =(C[-1]*1.22) - 19.14 -> 12.348199999999999 | U66: =(C[-2]*0.81) +27.23 -> 48.136099999999999 | V66: =(C[-3]*2.04) + 18.09 -> 70.742400000000004 | W66: =(C[-4]* 6.14)  - 80.71 -> 77.763400000000004 | X66: =(C[-5]*4.09)  - 41.81 -> 63.752899999999983 | Y66: =(C[-6]*2.04)- 16.9 -> 35.752400000000002 | Z66: =(C[-7]*6.14)  - 100.71 -> 57.763400000000004 | AA66: =(C[-8]*2.04) + 10.09 -> 62.742400000000004 | AB66: =(C[-9]*0.81) + 79.23 -> 100.1361 | AC66: =(C[-10]*2.04) - 44.9 -> 7.7524000000000015 | AD66: =(C[-11]*2.04) - 39.9 -> 12.752400000000002 | AE66: =(C[-12]*0.81) - 16.76 -> 4.146099999999997 | AF66: =(C[-13]*0.81) - 20.76 -> 0.14609999999999701 | AG66: =(C[-14]*4.09) - 43.81 -> 61.752899999999983 | AH66: =(C[-15]*2.04) - 49.9 -> 2.7524000000000015
A67: 57 | B67: 2023-05-04 14:47:07 | C67: 17.809999999999999 | D67: 52.81 | E67: 74.81 | F67: 89.81 | G67: 69.81 | H67: 41.81 | I67: 64.81 | J67: 69.81 | K67: 103.81 | L67: 9.81 | M67: 15.81 | N67: 8.81 | O67: 4.8099999999999996 | P67: 69.81 | Q67: 9.81 | S67: =RC[-16]+8 -> 25.81 | T67: =(C[-1]*1.22) - 19.14 -> 12.348199999999999 | U67: =(C[-2]*0.81) +27.23 -> 48.136099999999999 | V67: =(C[-3]*2.04) + 18.09 -> 70.742400000000004 | W67: =(C[-4]* 6.14)  - 80.71 -> 77.763400000000004 | X67: =(C[-5]*4.09)  - 41.81 -> 63.752899999999983 | Y67: =(C[-6]*2.04)- 16.9 -> 35.752400000000002 | Z67: =(C[-7]*6.14)  - 100.71 -> 57.763400000000004 | AA67: =(C[-8]*2.04) + 10.09 -> 62.742400000000004 | AB67: =(C[-9]*0.81) + 79.23 -> 100.1361 | AC67: =(C[-10]*2.04) - 44.9 -> 7.7524000000000015 | AD67: =(C[-11]*2.04) - 39.9 -> 12.752400000000002 | AE67: =(C[-12]*0.81) - 16.76 -> 4.146099999999997 | AF67: =(C[-13]*0.81) - 20.76 -> 0.14609999999999701 | AG67: =(C[-14]*4.09) - 43.81 -> 61.752899999999983 | AH67: =(C[-15]*2.04) - 49.9 -> 2.7524000000000015
A68: 59 | B68: 2023-05-04 14:47:11 | C68: 17.809999999999999 | D68: 52.81 | E68: 74.81 | F68: 89.81 | G68: 69.81 | H68: 41.81 | I68: 64.81 | J68: 69.81 | K68: 103.81 | L68: 9.81 | M68: 15.81 | N68: 8.81 | O68: 4.8099999999999996 | P68: 69.81 | Q68: 9.81 | S68: =RC[-16]+8 -> 25.81 | T68: =(C[-1]*1.22) - 19.14 -> 12.348199999999999 | U68: =(C[-2]*0.81) +27.23 -> 48.136099999999999 | V68: =(C[-3]*2.04) + 18.09 -> 70.742400000000004 | W68: =(C[-4]* 6.14)  - 80.71 -> 77.763400000000004 | X68: =(C[-5]*4.09)  - 41.81 -> 63.752899999999983 | Y68: =(C[-6]*2.04)- 16.9 -> 35.752400000000002 | Z68: =(C[-7]*6.14)  - 100.71 -> 57.763400000000004 | AA68: =(C[-8]*2.04) + 10.09 -> 62.742400000000004 | AB68: =(C[-9]*0.81) + 79.23 -> 100.1361 | AC68: =(C[-10]*2.04) - 44.9 -> 7.7524000000000015 | AD68: =(C[-11]*2.04) - 39.9 -> 12.752400000000002 | AE68: =(C[-12]*0.81) - 16.76 -> 4.146099999999997 | AF68: =(C[-13]*0.81) - 20.76 -> 0.14609999999999701 | AG68: =(C[-14]*4.09) - 43.81 -> 61.752899999999983 | AH68: =(C[-15]*2.04) - 49.9 -> 2.7524000000000015
A69: 60 | B69: 2023-05-04 14:47:13 | C69: 17.809999999999999 | D69: 52.81 | E69: 74.81 | F69: 89.81 | G69: 69.81 | H69: 41.81 | I69: 64.81 | J69: 69.81 | K69: 103.81 | L69: 9.81 | M69: 15.81 | N69: 8.81 | O69: 4.8099999999999996 | P69: 69.81 | Q69: 9.81 | S69: =RC[-16]+8 -> 25.81 | T69: =(C[-1]*1.22) - 19.14 -> 12.348199999999999 | U69: =(C[-2]*0.81) +27.23 -> 48.136099999999999 | V69: =(C[-3]*2.04) + 18.09 -> 70.742400000000004 | W69: =(C[-4]* 6.14)  - 80.71 -> 77.763400000000004 | X69: =(C[-5]*4.09)  - 41.81 -> 63.752899999999983 | Y69: =(C[-6]*2.04)- 16.9 -> 35.752400000000002 | Z69: =(C[-7]*6.14)  - 100.71 -> 57.763400000000004 | AA69: =(C[-8]*2.04) + 10.09 -> 62.742400000000004 | AB69: =(C[-9]*0.81) + 79.23 -> 100.1361 | AC69: =(C[-10]*2.04) - 44.9 -> 7.7524000000000015 | AD69: =(C[-11]*2.04) - 39.9 -> 12.752400000000002 | AE69: =(C[-12]*0.81) - 16.76 -> 4.146099999999997 | AF69: =(C[-13]*0.81) - 20.76 -> 0.14609999999999701 | AG69: =(C[-14]*4.09) - 43.81 -> 61.752899999999983 | AH69: =(C[-15]*2.04) - 49.9 -> 2.7524000000000015
A70: 62 | B70: 2023-05-04 14:47:17 | C70: 17.809999999999999 | D70: 52.81 | E70: 74.81 | F70: 89.81 | G70: 69.81 | H70: 41.81 | I70: 64.81 | J70: 69.81 | K70: 103.81 | L70: 9.81 | M70: 15.81 | N70: 8.81 | O70: 4.8099999999999996 | P70: 69.81 | Q70: 9.81 | S70: =RC[-16]+8 -> 25.81 | T70: =(C[-1]*1.22) - 19.14 -> 12.348199999999999 | U70: =(C[-2]*0.81) +27.23 -> 48.136099999999999 | V70: =(C[-3]*2.04) + 18.09 -> 70.742400000000004 | W70: =(C[-4]* 6.14)  - 80.71 -> 77.763400000000004 | X70: =(C[-5]*4.09)  - 41.81 -> 63.752899999999983 | Y70: =(C[-6]*2.04)- 16.9 -> 35.752400000000002 | Z70: =(C[-7]*6.14)  - 100.71 -> 57.763400000000004 | AA70: =(C[-8]*2.04) + 10.09 -> 62.742400000000004 | AB70: =(C[-9]*0.81) + 79.23 -> 100.1361 | AC70: =(C[-10]*2.04) - 44.9 -> 7.7524000000000015 | AD70: =(C[-11]*2.04) - 39.9 -> 12.752400000000002 | AE70: =(C[-12]*0.81) - 16.76 -> 4.146099999999997 | AF70: =(C[-13]*0.81) - 20.76 -> 0.14609999999999701 | AG70: =(C[-14]*4.09) - 43.81 -> 61.752899999999983 | AH70: =(C[-15]*2.04) - 49.9 -> 2.7524000000000015
A71: 64 | B71: 2023-05-04 14:47:21 | C71: 17.809999999999999 | D71: 52.81 | E71: 74.81 | F71: 89.81 | G71: 69.81 | H71: 41.81 | I71: 64.81 | J71: 69.81 | K71: 103.81 | L71: 9.81 | M71: 15.81 | N71: 8.81 | O71: 4.8099999999999996 | P71: 69.81 | Q71: 9.81 | S71: =RC[-16]+8 -> 25.81 | T71: =(C[-1]*1.22) - 19.14 -> 12.348199999999999 | U71: =(C[-2]*0.81) +27.23 -> 48.136099999999999 | V71: =(C[-3]*2.04) + 18.09 -> 70.742400000000004 | W71: =(C[-4]* 6.14)  - 80.71 -> 77.763400000000004 | X71: =(C[-5]*4.09)  - 41.81 -> 63.752899999999983 | Y71: =(C[-6]*2.04)- 16.9 -> 35.752400000000002 | Z71: =(C[-7]*6.14)  - 100.71 -> 57.763400000000004 | AA71: =(C[-8]*2.04) + 10.09 -> 62.742400000000004 | AB71: =(C[-9]*0.81) + 79.23 -> 100.1361 | AC71: =(C[-10]*2.04) - 44.9 -> 7.7524000000000015 | AD71: =(C[-11]*2.04) - 39.9 -> 12.752400000000002 | AE71: =(C[-12]*0.81) - 16.76 -> 4.146099999999997 | AF71: =(C[-13]*0.81) - 20.76 -> 0.14609999999999701 | AG71: =(C[-14]*4.09) - 43.81 -> 61.752899999999983 | AH71: =(C[-15]*2.04) - 49.9 -> 2.7524000000000015
A72: 66 | B72: 2023-05-04 14:47:25 | C72: 17.809999999999999 | D72: 52.81 | E72: 74.81 | F72: 89.81 | G72: 69.81 | H72: 41.81 | I72: 64.81 | J72: 69.81 | K72: 103.81 | L72: 9.81 | M72: 15.81 | N72: 8.81 | O72: 4.8099999999999996 | P72: 69.81 | Q72: 9.81 | S72: =RC[-16]+8 -> 25.81 | T72: =(C[-1]*1.22) - 19.14 -> 12.348199999999999 | U72: =(C[-2]*0.81) +27.23 -> 48.136099999999999 | V72: =(C[-3]*2.04) + 18.09 -> 70.742400000000004 | W72: =(C[-4]* 6.14)  - 80.71 -> 77.763400000000004 | X72: =(C[-5]*4.09)  - 41.81 -> 63.752899999999983 | Y72: =(C[-6]*2.04)- 16.9 -> 35.752400000000002 | Z72: =(C[-7]*6.14)  - 100.71 -> 57.763400000000004 | AA72: =(C[-8]*2.04) + 10.09 -> 62.742400000000004 | AB72: =(C[-9]*0.81) + 79.23 -> 100.1361 | AC72: =(C[-10]*2.04) - 44.9 -> 7.7524000000000015 | AD72: =(C[-11]*2.04) - 39.9 -> 12.752400000000002 | AE72: =(C[-12]*0.81) - 16.76 -> 4.146099999999997 | AF72: =(C[-13]*0.81) - 20.76 -> 0.14609999999999701 | AG72: =(C[-14]*4.09) - 43.81 -> 61.752899999999983 | AH72: =(C[-15]*2.04) - 49.9 -> 2.7524000000000015
A73: 70 | B73: 2023-05-04 14:47:57 | C73: 17.809999999999999 | D73: 52.81 | E73: 74.81 | F73: 89.81 | G73: 69.81 | H73: 41.81 | I73: 64.81 | J73: 69.81 | K73: 103.81 | L73: 9.81 | M73: 15.81 | N73: 8.81 | O73: 4.8099999999999996 | P73: 69.81 | Q73: 9.81 | S73: =RC[-16]+8 -> 25.81 | T73: =(C[-1]*1.22) - 19.14 -> 12.348199999999999 | U73: =(C[-2]*0.81) +27.23 -> 48.136099999999999 | V73: =(C[-3]*2.04) + 18.09 -> 70.742400000000004 | W73: =(C[-4]* 6.14)  - 80.71 -> 77.763400000000004 | X73: =(C[-5]*4.09)  - 41.81 -> 63.752899999999983 | Y73: =(C[-6]*2.04)- 16.9 -> 35.752400000000002 | Z73: =(C[-7]*6.14)  - 100.71 -> 57.763400000000004 | AA73: =(C[-8]*2.04) + 10.09 -> 62.742400000000004 | AB73: =(C[-9]*0.81) + 79.23 -> 100.1361 | AC73: =(C[-10]*2.04) - 44.9 -> 7.7524000000000015 | AD73: =(C[-11]*2.04) - 39.9 -> 12.752400000000002 | AE73: =(C[-12]*0.81) - 16.76 -> 4.146099999999997 | AF73: =(C[-13]*0.81) - 20.76 -> 0.14609999999999701 | AG73: =(C[-14]*4.09) - 43.81 -> 61.752899999999983 | AH73: =(C[-15]*2.04) - 49.9 -> 2.7524000000000015
A74: 73 | B74: 2023-05-04 14:48:03 | C74: 17.809999999999999 | D74: 52.81 | E74: 74.81 | F74: 89.81 | G74: 69.81 | H74: 41.81 | I74: 64.81 | J74: 69.81 | K74: 103.81 | L74: 9.81 | M74: 15.81 | N74: 8.81 | O74: 4.8099999999999996 | P74: 69.81 | Q74: 9.81 | S74: =RC[-16]+8 -> 25.81 | T74: =(C[-1]*1.22) - 19.14 -> 12.348199999999999 | U74: =(C[-2]*0.81) +27.23 -> 48.136099999999999 | V74: =(C[-3]*2.04) + 18.09 -> 70.742400000000004 | W74: =(C[-4]* 6.14)  - 80.71 -> 77.763400000000004 | X74: =(C[-5]*4.09)  - 41.81 -> 63.752899999999983 | Y74: =(C[-6]*2.04)- 16.9 -> 35.752400000000002 | Z74: =(C[-7]*6.14)  - 100.71 -> 57.763400000000004 | AA74: =(C[-8]*2.04) + 10.09 -> 62.742400000000004 | AB74: =(C[-9]*0.81) + 79.23 -> 100.1361 | AC74: =(C[-10]*2.04) - 44.9 -> 7.7524000000000015 | AD74: =(C[-11]*2.04) - 39.9 -> 12.752400000000002 | AE74: =(C[-12]*0.81) - 16.76 -> 4.146099999999997 | AF74: =(C[-13]*0.81) - 20.76 -> 0.14609999999999701 | AG74: =(C[-14]*4.09) - 43.81 -> 61.752899999999983 | AH74: =(C[-15]*2.04) - 49.9 -> 2.7524000000000015
A75: 76 | B75: 2023-05-04 14:48:09 | C75: 17.809999999999999 | D75: 52.81 | E75: 74.81 | F75: 89.81 | G75: 69.81 | H75: 41.81 | I75: 64.81 | J75: 69.81 | K75: 103.81 | L75: 9.81 | M75: 15.81 | N75: 8.81 | O75: 4.8099999999999996 | P75: 69.81 | Q75: 9.81 | S75: =RC[-16]+8 -> 25.81 | T75: =(C[-1]*1.22) - 19.14 -> 12.348199999999999 | U75: =(C[-2]*0.81) +27.23 -> 48.136099999999999 | V75: =(C[-3]*2.04) + 18.09 -> 70.742400000000004 | W75: =(C[-4]* 6.14)  - 80.71 -> 77.763400000000004 | X75: =(C[-5]*4.09)  - 41.81 -> 63.752899999999983 | Y75: =(C[-6]*2.04)- 16.9 -> 35.752400000000002 | Z75: =(C[-7]*6.14)  - 100.71 -> 57.763400000000004 | AA75: =(C[-8]*2.04) + 10.09 -> 62.742400000000004 | AB75: =(C[-9]*0.81) + 79.23 -> 100.1361 | AC75: =(C[-10]*2.04) - 44.9 -> 7.7524000000000015 | AD75: =(C[-11]*2.04) - 39.9 -> 12.752400000000002 | AE75: =(C[-12]*0.81) - 16.76 -> 4.146099999999997 | AF75: =(C[-13]*0.81) - 20.76 -> 0.14609999999999701 | AG75: =(C[-14]*4.09) - 43.81 -> 61.752899999999983 | AH75: =(C[-15]*2.04) - 49.9 -> 2.7524000000000015
A76: 77 | B76: 2023-05-04 14:48:51 | C76: 17.809999999999999 | D76: 52.81 | E76: 74.81 | F76: 89.81 | G76: 69.81 | H76: 41.81 | I76: 64.81 | J76: 69.81 | K76: 103.81 | L76: 9.81 | M76: 15.81 | N76: 8.81 | O76: 4.8099999999999996 | P76: 69.81 | Q76: 9.81 | S76: =RC[-16]+8 -> 25.81 | T76: =(C[-1]*1.22) - 19.14 -> 12.348199999999999 | U76: =(C[-2]*0.81) +27.23 -> 48.136099999999999 | V76: =(C[-3]*2.04) + 18.09 -> 70.742400000000004 | W76: =(C[-4]* 6.14)  - 80.71 -> 77.763400000000004 | X76: =(C[-5]*4.09)  - 41.81 -> 63.752899999999983 | Y76: =(C[-6]*2.04)- 16.9 -> 35.752400000000002 | Z76: =(C[-7]*6.14)  - 100.71 -> 57.763400000000004 | AA76: =(C[-8]*2.04) + 10.09 -> 62.742400000000004 | AB76: =(C[-9]*0.81) + 79.23 -> 100.1361 | AC76: =(C[-10]*2.04) - 44.9 -> 7.7524000000000015 | AD76: =(C[-11]*2.04) - 39.9 -> 12.752400000000002 | AE76: =(C[-12]*0.81) - 16.76 -> 4.146099999999997 | AF76: =(C[-13]*0.81) - 20.76 -> 0.14609999999999701 | AG76: =(C[-14]*4.09) - 43.81 -> 61.752899999999983 | AH76: =(C[-15]*2.04) - 49.9 -> 2.7524000000000015
A77: 78 | B77: 2023-05-04 14:48:53 | C77: 17.809999999999999 | D77: 52.81 | E77: 74.81 | F77: 89.81 | G77: 69.81 | H77: 41.81 | I77: 64.81 | J77: 69.81 | K77: 103.81 | L77: 9.81 | M77: 15.81 | N77: 8.81 | O77: 4.8099999999999996 | P77: 69.81 | Q77: 9.81 | S77: =RC[-16]+8 -> 25.81 | T77: =(C[-1]*1.22) - 19.14 -> 12.348199999999999 | U77: =(C[-2]*0.81) +27.23 -> 48.136099999999999 | V77: =(C[-3]*2.04) + 18.09 -> 70.742400000000004 | W77: =(C[-4]* 6.14)  - 80.71 -> 77.763400000000004 | X77: =(C[-5]*4.09)  - 41.81 -> 63.752899999999983 | Y77: =(C[-6]*2.04)- 16.9 -> 35.752400000000002 | Z77: =(C[-7]*6.14)  - 100.71 -> 57.763400000000004 | AA77: =(C[-8]*2.04) + 10.09 -> 62.742400000000004 | AB77: =(C[-9]*0.81) + 79.23 -> 100.1361 | AC77: =(C[-10]*2.04) - 44.9 -> 7.7524000000000015 | AD77: =(C[-11]*2.04) - 39.9 -> 12.752400000000002 | AE77: =(C[-12]*0.81) - 16.76 -> 4.146099999999997 | AF77: =(C[-13]*0.81) - 20.76 -> 0.14609999999999701 | AG77: =(C[-14]*4.09) - 43.81 -> 61.752899999999983 | AH77: =(C[-15]*2.04) - 49.9 -> 2.7524000000000015
A78: 79 | B78: 2023-05-04 14:48:55 | C78: 17.809999999999999 | D78: 52.81 | E78: 74.81 | F78: 89.81 | G78: 69.81 | H78: 41.81 | I78: 64.81 | J78: 69.81 | K78: 103.81 | L78: 9.81 | M78: 15.81 | N78: 8.81 | O78: 4.8099999999999996 | P78: 69.81 | Q78: 9.81 | S78: =RC[-16]+8 -> 25.81 | T78: =(C[-1]*1.22) - 19.14 -> 12.348199999999999 | U78: =(C[-2]*0.81) +27.23 -> 48.136099999999999 | V78: =(C[-3]*2.04) + 18.09 -> 70.742400000000004 | W78: =(C[-4]* 6.14)  - 80.71 -> 77.763400000000004 | X78: =(C[-5]*4.09)  - 41.81 -> 63.752899999999983 | Y78: =(C[-6]*2.04)- 16.9 -> 35.752400000000002 | Z78: =(C[-7]*6.14)  - 100.71 -> 57.763400000000004 | AA78: =(C[-8]*2.04) + 10.09 -> 62.742400000000004 | AB78: =(C[-9]*0.81) + 79.23 -> 100.1361 | AC78: =(C[-10]*2.04) - 44.9 -> 7.7524000000000015 | AD78: =(C[-11]*2.04) - 39.9 -> 12.752400000000002 | AE78: =(C[-12]*0.81) - 16.76 -> 4.146099999999997 | AF78: =(C[-13]*0.81) - 20.76 -> 0.14609999999999701 | AG78: =(C[-14]*4.09) - 43.81 -> 61.752899999999983 | AH78: =(C[-15]*2.04) - 49.9 -> 2.7524000000000015
A79: 80 | B79: 2023-05-04 14:48:57 | C79: 17.809999999999999 | D79: 52.81 | E79: 74.81 | F79: 89.81 | G79: 69.81 | H79: 41.81 | I79: 64.81 | J79: 69.81 | K79: 103.81 | L79: 9.81 | M79: 15.81 | N79: 8.81 | O79: 4.8099999999999996 | P79: 69.81 | Q79: 9.81 | S79: =RC[-16]+8 -> 25.81 | T79: =(C[-1]*1.22) - 19.14 -> 12.348199999999999 | U79: =(C[-2]*0.81) +27.23 -> 48.136099999999999 | V79: =(C[-3]*2.04) + 18.09 -> 70.742400000000004 | W79: =(C[-4]* 6.14)  - 80.71 -> 77.763400000000004 | X79: =(C[-5]*4.09)  - 41.81 -> 63.752899999999983 | Y79: =(C[-6]*2.04)- 16.9 -> 35.752400000000002 | Z79: =(C[-7]*6.14)  - 100.71 -> 57.763400000000004 | AA79: =(C[-8]*2.04) + 10.09 -> 62.742400000000004 | AB79: =(C[-9]*0.81) + 79.23 -> 100.1361 | AC79: =(C[-10]*2.04) - 44.9 -> 7.7524000000000015 | AD79: =(C[-11]*2.04) - 39.9 -> 12.752400000000002 | AE79: =(C[-12]*0.81) - 16.76 -> 4.146099999999997 | AF79: =(C[-13]*0.81) - 20.76 -> 0.14609999999999701 | AG79: =(C[-14]*4.09) - 43.81 -> 61.752899999999983 | AH79: =(C[-15]*2.04) - 49.9 -> 2.7524000000000015
A80: 82 | B80: 2023-05-04 14:49:01 | C80: 17.809999999999999 | D80: 52.81 | E80: 74.81 | F80: 89.81 | G80: 69.81 | H80: 41.81 | I80: 64.81 | J80: 69.81 | K80: 103.81 | L80: 9.81 | M80: 15.81 | N80: 8.81 | O80: 4.8099999999999996 | P80: 69.81 | Q80: 9.81 | S80: =RC[-16]+8 -> 25.81 | T80: =(C[-1]*1.22) - 19.14 -> 12.348199999999999 | U80: =(C[-2]*0.81) +27.23 -> 48.136099999999999 | V80: =(C[-3]*2.04) + 18.09 -> 70.742400000000004 | W80: =(C[-4]* 6.14)  - 80.71 -> 77.763400000000004 | X80: =(C[-5]*4.09)  - 41.81 -> 63.752899999999983 | Y80: =(C[-6]*2.04)- 16.9 -> 35.752400000000002 | Z80: =(C[-7]*6.14)  - 100.71 -> 57.763400000000004 | AA80: =(C[-8]*2.04) + 10.09 -> 62.742400000000004 | AB80: =(C[-9]*0.81) + 79.23 -> 100.1361 | AC80: =(C[-10]*2.04) - 44.9 -> 7.7524000000000015 | AD80: =(C[-11]*2.04) - 39.9 -> 12.752400000000002 | AE80: =(C[-12]*0.81) - 16.76 -> 4.146099999999997 | AF80: =(C[-13]*0.81) - 20.76 -> 0.14609999999999701 | AG80: =(C[-14]*4.09) - 43.81 -> 61.752899999999983 | AH80: =(C[-15]*2.04) - 49.9 -> 2.7524000000000015
A81: 83 | B81: 2023-05-04 14:49:03 | C81: 17.809999999999999 | D81: 52.81 | E81: 74.81 | F81: 89.81 | G81: 69.81 | H81: 41.81 | I81: 64.81 | J81: 69.81 | K81: 103.81 | L81: 9.81 | M81: 15.81 | N81: 8.81 | O81: 4.8099999999999996 | P81: 69.81 | Q81: 9.81 | S81: =RC[-16]+8 -> 25.81 | T81: =(C[-1]*1.22) - 19.14 -> 12.348199999999999 | U81: =(C[-2]*0.81) +27.23 -> 48.136099999999999 | V81: =(C[-3]*2.04) + 18.09 -> 70.742400000000004 | W81: =(C[-4]* 6.14)  - 80.71 -> 77.763400000000004 | X81: =(C[-5]*4.09)  - 41.81 -> 63.752899999999983 | Y81: =(C[-6]*2.04)- 16.9 -> 35.752400000000002 | Z81: =(C[-7]*6.14)  - 100.71 -> 57.763400000000004 | AA81: =(C[-8]*2.04) + 10.09 -> 62.742400000000004 | AB81: =(C[-9]*0.81) + 79.23 -> 100.1361 | AC81: =(C[-10]*2.04) - 44.9 -> 7.7524000000000015 | AD81: =(C[-11]*2.04) - 39.9 -> 12.752400000000002 | AE81: =(C[-12]*0.81) - 16.76 -> 4.146099999999997 | AF81: =(C[-13]*0.81) - 20.76 -> 0.14609999999999701 | AG81: =(C[-14]*4.09) - 43.81 -> 61.752899999999983 | AH81: =(C[-15]*2.04) - 49.9 -> 2.7524000000000015
A82: 84 | B82: 2023-05-04 14:49:05 | C82: 17.809999999999999 | D82: 52.81 | E82: 74.81 | F82: 89.81 | G82: 69.81 | H82: 41.81 | I82: 64.81 | J82: 69.81 | K82: 103.81 | L82: 9.81 | M82: 15.81 | N82: 8.81 | O82: 4.8099999999999996 | P82: 69.81 | Q82: 9.81 | S82: =RC[-16]+8 -> 25.81 | T82: =(C[-1]*1.22) - 19.14 -> 12.348199999999999 | U82: =(C[-2]*0.81) +27.23 -> 48.136099999999999 | V82: =(C[-3]*2.04) + 18.09 -> 70.742400000000004 | W82: =(C[-4]* 6.14)  - 80.71 -> 77.763400000000004 | X82: =(C[-5]*4.09)  - 41.81 -> 63.752899999999983 | Y82: =(C[-6]*2.04)- 16.9 -> 35.752400000000002 | Z82: =(C[-7]*6.14)  - 100.71 -> 57.763400000000004 | AA82: =(C[-8]*2.04) + 10.09 -> 62.742400000000004 | AB82: =(C[-9]*0.81) + 79.23 -> 100.1361 | AC82: =(C[-10]*2.04) - 44.9 -> 7.7524000000000015 | AD82: =(C[-11]*2.04) - 39.9 -> 12.752400000000002 | AE82: =(C[-12]*0.81) - 16.76 -> 4.146099999999997 | AF82: =(C[-13]*0.81) - 20.76 -> 0.14609999999999701 | AG82: =(C[-14]*4.09) - 43.81 -> 61.752899999999983 | AH82: =(C[-15]*2.04) - 49.9 -> 2.7524000000000015
A83: 86 | B83: 2023-05-04 14:49:09 | C83: 17.809999999999999 | D83: 52.81 | E83: 74.81 | F83: 89.81 | G83: 69.81 | H83: 41.81 | I83: 64.81 | J83: 69.81 | K83: 103.81 | L83: 9.81 | M83: 15.81 | N83: 8.81 | O83: 4.8099999999999996 | P83: 69.81 | Q83: 9.81 | S83: =RC[-16]+8 -> 25.81 | T83: =(C[-1]*1.22) - 19.14 -> 12.348199999999999 | U83: =(C[-2]*0.81) +27.23 -> 48.136099999999999 | V83: =(C[-3]*2.04) + 18.09 -> 70.742400000000004 | W83: =(C[-4]* 6.14)  - 80.71 -> 77.763400000000004 | X83: =(C[-5]*4.09)  - 41.81 -> 63.752899999999983 | Y83: =(C[-6]*2.04)- 16.9 -> 35.752400000000002 | Z83: =(C[-7]*6.14)  - 100.71 -> 57.763400000000004 | AA83: =(C[-8]*2.04) + 10.09 -> 62.742400000000004 | AB83: =(C[-9]*0.81) + 79.23 -> 100.1361 | AC83: =(C[-10]*2.04) - 44.9 -> 7.7524000000000015 | AD83: =(C[-11]*2.04) - 39.9 -> 12.752400000000002 | AE83: =(C[-12]*0.81) - 16.76 -> 4.146099999999997 | AF83: =(C[-13]*0.81) - 20.76 -> 0.14609999999999701 | AG83: =(C[-14]*4.09) - 43.81 -> 61.752899999999983 | AH83: =(C[-15]*2.04) - 49.9 -> 2.7524000000000015
A84: 90 | B84: 2023-05-04 14:49:17 | C84: 17.809999999999999 | D84: 52.81 | E84: 74.81 | F84: 89.81 | G84: 69.81 | H84: 41.81 | I84: 64.81 | J84: 69.81 | K84: 103.81 | L84: 9.81 | M84: 15.81 | N84: 8.81 | O84: 4.8099999999999996 | P84: 69.81 | Q84: 9.81 | S84: =RC[-16]+8 -> 25.81 | T84: =(C[-1]*1.22) - 19.14 -> 12.348199999999999 | U84: =(C[-2]*0.81) +27.23 -> 48.136099999999999 | V84: =(C[-3]*2.04) + 18.09 -> 70.742400000000004 | W84: =(C[-4]* 6.14)  - 80.71 -> 77.763400000000004 | X84: =(C[-5]*4.09)  - 41.81 -> 63.752899999999983 | Y84: =(C[-6]*2.04)- 16.9 -> 35.752400000000002 | Z84: =(C[-7]*6.14)  - 100.71 -> 57.763400000000004 | AA84: =(C[-8]*2.04) + 10.09 -> 62.742400000000004 | AB84: =(C[-9]*0.81) + 79.23 -> 100.1361 | AC84: =(C[-10]*2.04) - 44.9 -> 7.7524000000000015 | AD84: =(C[-11]*2.04) - 39.9 -> 12.752400000000002 | AE84: =(C[-12]*0.81) - 16.76 -> 4.146099999999997 | AF84: =(C[-13]*0.81) - 20.76 -> 0.14609999999999701 | AG84: =(C[-14]*4.09) - 43.81 -> 61.752899999999983 | AH84: =(C[-15]*2.04) - 49.9 -> 2.7524000000000015
A85: 96 | B85: 2023-05-04 14:49:29 | C85: 17.809999999999999 | D85: 52.81 | E85: 74.81 | F85: 89.81 | G85: 69.81 | H85: 41.81 | I85: 64.81 | J85: 69.81 | K85: 103.81 | L85: 9.81 | M85: 15.81 | N85: 8.81 | O85: 4.8099999999999996 | P85: 69.81 | Q85: 9.81 | S85: =RC[-16]+8 -> 25.81 | T85: =(C[-1]*1.22) - 19.14 -> 12.348199999999999 | U85: =(C[-2]*0.81) +27.23 -> 48.136099999999999 | V85: =(C[-3]*2.04) + 18.09 -> 70.742400000000004 | W85: =(C[-4]* 6.14)  - 80.71 -> 77.763400000000004 | X85: =(C[-5]*4.09)  - 41.81 -> 63.752899999999983 | Y85: =(C[-6]*2.04)- 16.9 -> 35.752400000000002 | Z85: =(C[-7]*6.14)  - 100.71 -> 57.763400000000004 | AA85: =(C[-8]*2.04) + 10.09 -> 62.742400000000004 | AB85: =(C[-9]*0.81) + 79.23 -> 100.1361 | AC85: =(C[-10]*2.04) - 44.9 -> 7.7524000000000015 | AD85: =(C[-11]*2.04) - 39.9 -> 12.752400000000002 | AE85: =(C[-12]*0.81) - 16.76 -> 4.146099999999997 | AF85: =(C[-13]*0.81) - 20.76 -> 0.14609999999999701 | AG85: =(C[-14]*4.09) - 43.81 -> 61.752899999999983 | AH85: =(C[-15]*2.04) - 49.9 -> 2.7524000000000015
A86: 97 | B86: 2023-05-04 14:49:31 | C86: 17.809999999999999 | D86: 52.81 | E86: 74.81 | F86: 89.81 | G86: 69.81 | H86: 41.81 | I86: 64.81 | J86: 69.81 | K86: 103.81 | L86: 9.81 | M86: 15.81 | N86: 8.81 | O86: 4.8099999999999996 | P86: 69.81 | Q86: 9.81 | S86: =RC[-16]+8 -> 25.81 | T86: =(C[-1]*1.22) - 19.14 -> 12.348199999999999 | U86: =(C[-2]*0.81) +27.23 -> 48.136099999999999 | V86: =(C[-3]*2.04) + 18.09 -> 70.742400000000004 | W86: =(C[-4]* 6.14)  - 80.71 -> 77.763400000000004 | X86: =(C[-5]*4.09)  - 41.81 -> 63.752899999999983 | Y86: =(C[-6]*2.04)- 16.9 -> 35.752400000000002 | Z86: =(C[-7]*6.14)  - 100.71 -> 57.763400000000004 | AA86: =(C[-8]*2.04) + 10.09 -> 62.742400000000004 | AB86: =(C[-9]*0.81) + 79.23 -> 100.1361 | AC86: =(C[-10]*2.04) - 44.9 -> 7.7524000000000015 | AD86: =(C[-11]*2.04) - 39.9 -> 12.752400000000002 | AE86: =(C[-12]*0.81) - 16.76 -> 4.146099999999997 | AF86: =(C[-13]*0.81) - 20.76 -> 0.14609999999999701 | AG86: =(C[-14]*4.09) - 43.81 -> 61.752899999999983 | AH86: =(C[-15]*2.04) - 49.9 -> 2.7524000000000015
A87: 98 | B87: 2023-05-04 14:49:33 | C87: 17.809999999999999 | D87: 52.81 | E87: 74.81 | F87: 89.81 | G87: 69.81 | H87: 41.81 | I87: 64.81 | J87: 69.81 | K87: 103.81 | L87: 9.81 | M87: 15.81 | N87: 8.81 | O87: 4.8099999999999996 | P87: 69.81 | Q87: 9.81 | S87: =RC[-16]+8 -> 25.81 | T87: =(C[-1]*1.22) - 19.14 -> 12.348199999999999 | U87: =(C[-2]*0.81) +27.23 -> 48.136099999999999 | V87: =(C[-3]*2.04) + 18.09 -> 70.742400000000004 | W87: =(C[-4]* 6.14)  - 80.71 -> 77.763400000000004 | X87: =(C[-5]*4.09)  - 41.81 -> 63.752899999999983 | Y87: =(C[-6]*2.04)- 16.9 -> 35.752400000000002 | Z87: =(C[-7]*6.14)  - 100.71 -> 57.763400000000004 | AA87: =(C[-8]*2.04) + 10.09 -> 62.742400000000004 | AB87: =(C[-9]*0.81) + 79.23 -> 100.1361 | AC87: =(C[-10]*2.04) - 44.9 -> 7.7524000000000015 | AD87: =(C[-11]*2.04) - 39.9 -> 12.752400000000002 | AE87: =(C[-12]*0.81) - 16.76 -> 4.146099999999997 | AF87: =(C[-13]*0.81) - 20.76 -> 0.14609999999999701 | AG87: =(C[-14]*4.09) - 43.81 -> 61.752899999999983 | AH87: =(C[-15]*2.04) - 49.9 -> 2.7524000000000015
A88: 43 | B88: 2023-05-04 14:43:04 | C88: 17.329999999999998 | D88: 52.33 | E88: 74.33 | F88: 89.33 | G88: 69.33 | H88: 41.33 | I88: 64.33 | J88: 69.33 | K88: 103.33 | L88: 9.33 | M88: 15.33 | N88: 8.33 | O88: 4.33 | P88: 69.33 | Q88: 9.33 | S88: =RC[-16]+8 -> 25.33 | T88: =(C[-1]*1.22) - 19.14 -> 11.762599999999996 | U88: =(C[-2]*0.81) +27.23 -> 47.747299999999996 | V88: =(C[-3]*2.04) + 18.09 -> 69.763199999999998 | W88: =(C[-4]* 6.14)  - 80.71 -> 74.816199999999995 | X88: =(C[-5]*4.09)  - 41.81 -> 61.789699999999982 | Y88: =(C[-6]*2.04)- 16.9 -> 34.773199999999996 | Z88: =(C[-7]*6.14)  - 100.71 -> 54.816199999999995 | AA88: =(C[-8]*2.04) + 10.09 -> 61.763199999999998 | AB88: =(C[-9]*0.81) + 79.23 -> 99.747299999999996 | AC88: =(C[-10]*2.04) - 44.9 -> 6.7731999999999957 | AD88: =(C[-11]*2.04) - 39.9 -> 11.773199999999996 | AE88: =(C[-12]*0.81) - 16.76 -> 3.7572999999999972 | AF88: =(C[-13]*0.81) - 20.76 -> -0.2427000000000028 | AG88: =(C[-14]*4.09) - 43.81 -> 59.789699999999982 | AH88: =(C[-15]*2.04) - 49.9 -> 1.7731999999999957
A89: 65 | B89: 2023-05-04 14:47:23 | C89: 17.329999999999998 | D89: 52.33 | E89: 74.33 | F89: 89.33 | G89: 69.33 | H89: 41.33 | I89: 64.33 | J89: 69.33 | K89: 103.33 | L89: 9.33 | M89: 15.33 | N89: 8.33 | O89: 4.33 | P89: 69.33 | Q89: 9.33 | S89: =RC[-16]+8 -> 25.33 | T89: =(C[-1]*1.22) - 19.14 -> 11.762599999999996 | U89: =(C[-2]*0.81) +27.23 -> 47.747299999999996 | V89: =(C[-3]*2.04) + 18.09 -> 69.763199999999998 | W89: =(C[-4]* 6.14)  - 80.71 -> 74.816199999999995 | X89: =(C[-5]*4.09)  - 41.81 -> 61.789699999999982 | Y89: =(C[-6]*2.04)- 16.9 -> 34.773199999999996 | Z89: =(C[-7]*6.14)  - 100.71 -> 54.816199999999995 | AA89: =(C[-8]*2.04) + 10.09 -> 61.763199999999998 | AB89: =(C[-9]*0.81) + 79.23 -> 99.747299999999996 | AC89: =(C[-10]*2.04) - 44.9 -> 6.7731999999999957 | AD89: =(C[-11]*2.04) - 39.9 -> 11.773199999999996 | AE89: =(C[-12]*0.81) - 16.76 -> 3.7572999999999972 | AF89: =(C[-13]*0.81) - 20.76 -> -0.2427000000000028 | AG89: =(C[-14]*4.09) - 43.81 -> 59.789699999999982 | AH89: =(C[-15]*2.04) - 49.9 -> 1.7731999999999957
A90: 81 | B90: 2023-05-04 14:48:59 | C90: 17.329999999999998 | D90: 52.33 | E90: 74.33 | F90: 89.33 | G90: 69.33 | H90: 41.33 | I90: 64.33 | J90: 69.33 | K90: 103.33 | L90: 9.33 | M90: 15.33 | N90: 8.33 | O90: 4.33 | P90: 69.33 | Q90: 9.33 | S90: =RC[-16]+8 -> 25.33 | T90: =(C[-1]*1.22) - 19.14 -> 11.762599999999996 | U90: =(C[-2]*0.81) +27.23 -> 47.747299999999996 | V90: =(C[-3]*2.04) + 18.09 -> 69.763199999999998 | W90: =(C[-4]* 6.14)  - 80.71 -> 74.816199999999995 | X90: =(C[-5]*4.09)  - 41.81 -> 61.789699999999982 | Y90: =(C[-6]*2.04)- 16.9 -> 34.773199999999996 | Z90: =(C[-7]*6.14)  - 100.71 -> 54.816199999999995 | AA90: =(C[-8]*2.04) + 10.09 -> 61.763199999999998 | AB90: =(C[-9]*0.81) + 79.23 -> 99.747299999999996 | AC90: =(C[-10]*2.04) - 44.9 -> 6.7731999999999957 | AD90: =(C[-11]*2.04) - 39.9 -> 11.773199999999996 | AE90: =(C[-12]*0.81) - 16.76 -> 3.7572999999999972 | AF90: =(C[-13]*0.81) - 20.76 -> -0.2427000000000028 | AG90: =(C[-14]*4.09) - 43.81 -> 59.789699999999982 | AH90: =(C[-15]*2.04) - 49.9 -> 1.7731999999999957
A91: 85 | B91: 2023-05-04 14:49:07 | C91: 17.329999999999998 | D91: 52.33 | E91: 74.33 | F91: 89.33 | G91: 69.33 | H91: 41.33 | I91: 64.33 | J91: 69.33 | K91: 103.33 | L91: 9.33 | M91: 15.33 | N91: 8.33 | O91: 4.33 | P91: 69.33 | Q91: 9.33 | S91: =RC[-16]+8 -> 25.33 | T91: =(C[-1]*1.22) - 19.14 -> 11.762599999999996 | U91: =(C[-2]*0.81) +27.23 -> 47.747299999999996 | V91: =(C[-3]*2.04) + 18.09 -> 69.763199999999998 | W91: =(C[-4]* 6.14)  - 80.71 -> 74.816199999999995 | X91: =(C[-5]*4.09)  - 41.81 -> 61.789699999999982 | Y91: =(C[-6]*2.04)- 16.9 -> 34.773199999999996 | Z91: =(C[-7]*6.14)  - 100.71 -> 54.816199999999995 | AA91: =(C[-8]*2.04) + 10.09 -> 61.763199999999998 | AB91: =(C[-9]*0.81) + 79.23 -> 99.747299999999996 | AC91: =(C[-10]*2.04) - 44.9 -> 6.7731999999999957 | AD91: =(C[-11]*2.04) - 39.9 -> 11.773199999999996 | AE91: =(C[-12]*0.81) - 16.76 -> 3.7572999999999972 | AF91: =(C[-13]*0.81) - 20.76 -> -0.2427000000000028 | AG91: =(C[-14]*4.09) - 43.81 -> 59.789699999999982 | AH91: =(C[-15]*2.04) - 49.9 -> 1.7731999999999957
A92: 87 | B92: 2023-05-04 14:49:11 | C92: 17.329999999999998 | D92: 52.33 | E92: 74.33 | F92: 89.33 | G92: 69.33 | H92: 41.33 | I92: 64.33 | J92: 69.33 | K92: 103.33 | L92: 9.33 | M92: 15.33 | N92: 8.33 | O92: 4.33 | P92: 69.33 | Q92: 9.33 | S92: =RC[-16]+8 -> 25.33 | T92: =(C[-1]*1.22) - 19.14 -> 11.762599999999996 | U92: =(C[-2]*0.81) +27.23 -> 47.747299999999996 | V92: =(C[-3]*2.04) + 18.09 -> 69.763199999999998 | W92: =(C[-4]* 6.14)  - 80.71 -> 74.816199999999995 | X92: =(C[-5]*4.09)  - 41.81 -> 61.789699999999982 | Y92: =(C[-6]*2.04)- 16.9 -> 34.773199999999996 | Z92: =(C[-7]*6.14)  - 100.71 -> 54.816199999999995 | AA92: =(C[-8]*2.04) + 10.09 -> 61.763199999999998 | AB92: =(C[-9]*0.81) + 79.23 -> 99.747299999999996 | AC92: =(C[-10]*2.04) - 44.9 -> 6.7731999999999957 | AD92: =(C[-11]*2.04) - 39.9 -> 11.773199999999996 | AE92: =(C[-12]*0.81) - 16.76 -> 3.7572999999999972 | AF92: =(C[-13]*0.81) - 20.76 -> -0.2427000000000028 | AG92: =(C[-14]*4.09) - 43.81 -> 59.789699999999982 | AH92: =(C[-15]*2.04) - 49.9 -> 1.7731999999999957
A93: 88 | B93: 2023-05-04 14:49:13 | C93: 17.329999999999998 | D93: 52.33 | E93: 74.33 | F93: 89.33 | G93: 69.33 | H93: 41.33 | I93: 64.33 | J93: 69.33 | K93: 103.33 | L93: 9.33 | M93: 15.33 | N93: 8.33 | O93: 4.33 | P93: 69.33 | Q93: 9.33 | S93: =RC[-16]+8 -> 25.33 | T93: =(C[-1]*1.22) - 19.14 -> 11.762599999999996 | U93: =(C[-2]*0.81) +27.23 -> 47.747299999999996 | V93: =(C[-3]*2.04) + 18.09 -> 69.763199999999998 | W93: =(C[-4]* 6.14)  - 80.71 -> 74.816199999999995 | X93: =(C[-5]*4.09)  - 41.81 -> 61.789699999999982 | Y93: =(C[-6]*2.04)- 16.9 -> 34.773199999999996 | Z93: =(C[-7]*6.14)  - 100.71 -> 54.816199999999995 | AA93: =(C[-8]*2.04) + 10.09 -> 61.763199999999998 | AB93: =(C[-9]*0.81) + 79.23 -> 99.747299999999996 | AC93: =(C[-10]*2.04) - 44.9 -> 6.7731999999999957 | AD93: =(C[-11]*2.04) - 39.9 -> 11.773199999999996 | AE93: =(C[-12]*0.81) - 16.76 -> 3.7572999999999972 | AF93: =(C[-13]*0.81) - 20.76 -> -0.2427000000000028 | AG93: =(C[-14]*4.09) - 43.81 -> 59.789699999999982 | AH93: =(C[-15]*2.04) - 49.9 -> 1.7731999999999957
A94: 89 | B94: 2023-05-04 14:49:15 | C94: 17.329999999999998 | D94: 52.33 | E94: 74.33 | F94: 89.33 | G94: 69.33 | H94: 41.33 | I94: 64.33 | J94: 69.33 | K94: 103.33 | L94: 9.33 | M94: 15.33 | N94: 8.33 | O94: 4.33 | P94: 69.33 | Q94: 9.33 | S94: =RC[-16]+8 -> 25.33 | T94: =(C[-1]*1.22) - 19.14 -> 11.762599999999996 | U94: =(C[-2]*0.81) +27.23 -> 47.747299999999996 | V94: =(C[-3]*2.04) + 18.09 -> 69.763199999999998 | W94: =(C[-4]* 6.14)  - 80.71 -> 74.816199999999995 | X94: =(C[-5]*4.09)  - 41.81 -> 61.789699999999982 | Y94: =(C[-6]*2.04)- 16.9 -> 34.773199999999996 | Z94: =(C[-7]*6.14)  - 100.71 -> 54.816199999999995 | AA94: =(C[-8]*2.04) + 10.09 -> 61.763199999999998 | AB94: =(C[-9]*0.81) + 79.23 -> 99.747299999999996 | AC94: =(C[-10]*2.04) - 44.9 -> 6.7731999999999957 | AD94: =(C[-11]*2.04) - 39.9 -> 11.773199999999996 | AE94: =(C[-12]*0.81) - 16.76 -> 3.7572999999999972 | AF94: =(C[-13]*0.81) - 20.76 -> -0.2427000000000028 | AG94: =(C[-14]*4.09) - 43.81 -> 59.789699999999982 | AH94: =(C[-15]*2.04) - 49.9 -> 1.7731999999999957
A95: 91 | B95: 2023-05-04 14:49:19 | C95: 17.329999999999998 | D95: 52.33 | E95: 74.33 | F95: 89.33 | G95: 69.33 | H95: 41.33 | I95: 64.33 | J95: 69.33 | K95: 103.33 | L95: 9.33 | M95: 15.33 | N95: 8.33 | O95: 4.33 | P95: 69.33 | Q95: 9.33 | S95: =RC[-16]+8 -> 25.33 | T95: =(C[-1]*1.22) - 19.14 -> 11.762599999999996 | U95: =(C[-2]*0.81) +27.23 -> 47.747299999999996 | V95: =(C[-3]*2.04) + 18.09 -> 69.763199999999998 | W95: =(C[-4]* 6.14)  - 80.71 -> 74.816199999999995 | X95: =(C[-5]*4.09)  - 41.81 -> 61.789699999999982 | Y95: =(C[-6]*2.04)- 16.9 -> 34.773199999999996 | Z95: =(C[-7]*6.14)  - 100.71 -> 54.816199999999995 | AA95: =(C[-8]*2.04) + 10.09 -> 61.763199999999998 | AB95: =(C[-9]*0.81) + 79.23 -> 99.747299999999996 | AC95: =(C[-10]*2.04) - 44.9 -> 6.7731999999999957 | AD95: =(C[-11]*2.04) - 39.9 -> 11.773199999999996 | AE95: =(C[-12]*0.81) - 16.76 -> 3.7572999999999972 | AF95: =(C[-13]*0.81) - 20.76 -> -0.2427000000000028 | AG95: =(C[-14]*4.09) - 43.81 -> 59.789699999999982 | AH95: =(C[-15]*2.04) - 49.9 -> 1.7731999999999957
A96: 92 | B96: 2023-05-04 14:49:21 | C96: 17.329999999999998 | D96: 52.33 | E96: 74.33 | F96: 89.33 | G96: 69.33 | H96: 41.33 | I96: 64.33 | J96: 69.33 | K96: 103.33 | L96: 9.33 | M96: 15.33 | N96: 8.33 | O96: 4.33 | P96: 69.33 | Q96: 9.33 | S96: =RC[-16]+8 -> 25.33 | T96: =(C[-1]*1.22) - 19.14 -> 11.762599999999996 | U96: =(C[-2]*0.81) +27.23 -> 47.747299999999996 | V96: =(C[-3]*2.04) + 18.09 -> 69.763199999999998 | W96: =(C[-4]* 6.14)  - 80.71 -> 74.816199999999995 | X96: =(C[-5]*4.09)  - 41.81 -> 61.789699999999982 | Y96: =(C[-6]*2.04)- 16.9 -> 34.773199999999996 | Z96: =(C[-7]*6.14)  - 100.71 -> 54.816199999999995 | AA96: =(C[-8]*2.04) + 10.09 -> 61.763199999999998 | AB96: =(C[-9]*0.81) + 79.23 -> 99.747299999999996 | AC96: =(C[-10]*2.04) - 44.9 -> 6.7731999999999957 | AD96: =(C[-11]*2.04) - 39.9 -> 11.773199999999996 | AE96: =(C[-12]*0.81) - 16.76 -> 3.7572999999999972 | AF96: =(C[-13]*0.81) - 20.76 -> -0.2427000000000028 | AG96: =(C[-14]*4.09) - 43.81 -> 59.789699999999982 | AH96: =(C[-15]*2.04) - 49.9 -> 1.7731999999999957
A97: 93 | B97: 2023-05-04 14:49:23 | C97: 17.329999999999998 | D97: 52.33 | E97: 74.33 | F97: 89.33 | G97: 69.33 | H97: 41.33 | I97: 64.33 | J97: 69.33 | K97: 103.33 | L97: 9.33 | M97: 15.33 | N97: 8.33 | O97: 4.33 | P97: 69.33 | Q97: 9.33 | S97: =RC[-16]+8 -> 25.33 | T97: =(C[-1]*1.22) - 19.14 -> 11.762599999999996 | U97: =(C[-2]*0.81) +27.23 -> 47.747299999999996 | V97: =(C[-3]*2.04) + 18.09 -> 69.763199999999998 | W97: =(C[-4]* 6.14)  - 80.71 -> 74.816199999999995 | X97: =(C[-5]*4.09)  - 41.81 -> 61.789699999999982 | Y97: =(C[-6]*2.04)- 16.9 -> 34.773199999999996 | Z97: =(C[-7]*6.14)  - 100.71 -> 54.816199999999995 | AA97: =(C[-8]*2.04) + 10.09 -> 61.763199999999998 | AB97: =(C[-9]*0.81) + 79.23 -> 99.747299999999996 | AC97: =(C[-10]*2.04) - 44.9 -> 6.7731999999999957 | AD97: =(C[-11]*2.04) - 39.9 -> 11.773199999999996 | AE97: =(C[-12]*0.81) - 16.76 -> 3.7572999999999972 | AF97: =(C[-13]*0.81) - 20.76 -> -0.2427000000000028 | AG97: =(C[-14]*4.09) - 43.81 -> 59.789699999999982 | AH97: =(C[-15]*2.04) - 49.9 -> 1.7731999999999957
A98: 94 | B98: 2023-05-04 14:49:25 | C98: 17.329999999999998 | D98: 52.33 | E98: 74.33 | F98: 89.33 | G98: 69.33 | H98: 41.33 | I98: 64.33 | J98: 69.33 | K98: 103.33 | L98: 9.33 | M98: 15.33 | N98: 8.33 | O98: 4.33 | P98: 69.33 | Q98: 9.33 | S98: =RC[-16]+8 -> 25.33 | T98: =(C[-1]*1.22) - 19.14 -> 11.762599999999996 | U98: =(C[-2]*0.81) +27.23 -> 47.747299999999996 | V98: =(C[-3]*2.04) + 18.09 -> 69.763199999999998 | W98: =(C[-4]* 6.14)  - 80.71 -> 74.816199999999995 | X98: =(C[-5]*4.09)  - 41.81 -> 61.789699999999982 | Y98: =(C[-6]*2.04)- 16.9 -> 34.773199999999996 | Z98: =(C[-7]*6.14)  - 100.71 -> 54.816199999999995 | AA98: =(C[-8]*2.04) + 10.09 -> 61.763199999999998 | AB98: =(C[-9]*0.81) + 79.23 -> 99.747299999999996 | AC98: =(C[-10]*2.04) - 44.9 -> 6.7731999999999957 | AD98: =(C[-11]*2.04) - 39.9 -> 11.773199999999996 | AE98: =(C[-12]*0.81) - 16.76 -> 3.7572999999999972 | AF98: =(C[-13]*0.81) - 20.76 -> -0.2427000000000028 | AG98: =(C[-14]*4.09) - 43.81 -> 59.789699999999982 | AH98: =(C[-15]*2.04) - 49.9 -> 1.7731999999999957
A99: 95 | B99: 2023-05-04 14:49:27 | C99: 17.329999999999998 | D99: 52.33 | E99: 74.33 | F99: 89.33 | G99: 69.33 | H99: 41.33 | I99: 64.33 | J99: 69.33 | K99: 103.33 | L99: 9.33 | M99: 15.33 | N99: 8.33 | O99: 4.33 | P99: 69.33 | Q99: 9.33 | S99: =RC[-16]+8 -> 25.33 | T99: =(C[-1]*1.22) - 19.14 -> 11.762599999999996 | U99: =(C[-2]*0.81) +27.23 -> 47.747299999999996 | V99: =(C[-3]*2.04) + 18.09 -> 69.763199999999998 | W99: =(C[-4]* 6.14)  - 80.71 -> 74.816199999999995 | X99: =(C[-5]*4.09)  - 41.81 -> 61.789699999999982 | Y99: =(C[-6]*2.04)- 16.9 -> 34.773199999999996 | Z99: =(C[-7]*6.14)  - 100.71 -> 54.816199999999995 | AA99: =(C[-8]*2.04) + 10.09 -> 61.763199999999998 | AB99: =(C[-9]*0.81) + 79.23 -> 99.747299999999996 | AC99: =(C[-10]*2.04) - 44.9 -> 6.7731999999999957 | AD99: =(C[-11]*2.04) - 39.9 -> 11.773199999999996 | AE99: =(C[-12]*0.81) - 16.76 -> 3.7572999999999972 | AF99: =(C[-13]*0.81) - 20.76 -> -0.2427000000000028 | AG99: =(C[-14]*4.09) - 43.81 -> 59.789699999999982 | AH99: =(C[-15]*2.04) - 49.9 -> 1.7731999999999957
A100: 99 | B100: 2023-05-04 14:49:35 | C100: 17.329999999999998 | D100: 52.33 | E100: 74.33 | F100: 89.33 | G100: 69.33 | H100: 41.33 | I100: 64.33 | J100: 69.33 | K100: 103.33 | L100: 9.33 | M100: 15.33 | N100: 8.33 | O100: 4.33 | P100: 69.33 | Q100: 9.33 | S100: =RC[-16]+8 -> 25.33 | T100: =(C[-1]*1.22) - 19.14 -> 11.762599999999996 | U100: =(C[-2]*0.81) +27.23 -> 47.747299999999996 | V100: =(C[-3]*2.04) + 18.09 -> 69.763199999999998 | W100: =(C[-4]* 6.14)  - 80.71 -> 74.816199999999995 | X100: =(C[-5]*4.09)  - 41.81 -> 61.789699999999982 | Y100: =(C[-6]*2.04)- 16.9 -> 34.773199999999996 | Z100: =(C[-7]*6.14)  - 100.71 -> 54.816199999999995 | AA100: =(C[-8]*2.04) + 10.09 -> 61.763199999999998 | AB100: =(C[-9]*0.81) + 79.23 -> 99.747299999999996 | AC100: =(C[-10]*2.04) - 44.9 -> 6.7731999999999957 | AD100: =(C[-11]*2.04) - 39.9 -> 11.773199999999996 | AE100: =(C[-12]*0.81) - 16.76 -> 3.7572999999999972 | AF100: =(C[-13]*0.81) - 20.76 -> -0.2427000000000028 | AG100: =(C[-14]*4.09) - 43.81 -> 59.789699999999982 | AH100: =(C[-15]*2.04) - 49.9 -> 1.7731999999999957